post_date,content,fanpage_name,reaction,share,comment,fanpage_url,post_url,image_urls,video_url
2026-06-13,"TƯƠNG LAI AN TÂM LÀ TƯƠNG LAI VỮNG VÀNG  🍀 Khi lựa chọn bảo hiểm nhân thọ, đích đến của chúng ta không chỉ dừng lại ở một lá chắn tài chính vững vàng trước rủi ro, mà sâu sắc hơn, là mong muốn kiến tạo một cuộc sống thịnh vượng và tốt đẹp hơn cho thế hệ mai sau.  Đó cũng chính là triết lý được Bảo Việt Nhân thọ gửi gắm qua chương trình tri ân ""Trọn Vạn Dặm An"" – nơi những giải pháp bảo vệ hòa cùng nhịp sống hiện đại và năng động của thời đại mới:  🚗🛵 Ô tô & Xe máy điện VinFast (VF6, VF3, Evo 200 Lite): Giải pháp di chuyển thông minh, tiết kiệm và phù hợp hoàn hảo với nhịp sống hiện đại. 🎾 Bộ quà tặng Pickleball cao cấp: Khơi dậy tinh thần thể thao, chủ động rèn luyện và chăm sóc sức khỏe mỗi ngày.  Sự chuẩn bị cho tương lai luôn cần một tầm nhìn toàn diện: bắt đầu bằng giải pháp tài chính chu toàn hôm nay, và tiếp nối bằng những lựa chọn văn minh cho ngày mai. 👉 Xem ngay chi tiết thể lệ chương trình: https://bit.ly/TronVanDamAn_fb Trọn Vạn Dặm An - Bắt đầu từ hôm nay! #BaoVietNhantho #TronVungvang #TronVanDamAn",Bảo Việt Nhân Thọ,74,19,1,https://www.facebook.com/www.BaoVietNhanTho.com.vn,https://www.facebook.com/www.BaoVietNhanTho.com.vn/posts/pfbid0Pf9jZ3V72k112nXVHf6VdYsUmrSV8FcFV6YnZJnrqMUL3ufjrmEjLEq8Nm1nXc4Wl,https://scontent.fsgn5-15.fna.fbcdn.net/v/t39.99422-6/723838781_2393368698177467_4612834719788989918_n.png?stp=dst-jpg_tt6&cstp=mx1898x1898&ctp=s1080x2048&_nc_cat=111&ccb=1-7&_nc_sid=127cfc&_nc_ohc=8xy8CRcg28QQ7kNvwHt8M64&_nc_oc=AdpHKqvE3r0a8WdwKH9taiPHgvHMhapfC-lTBhNWoICKoipAXEYmvuQ1dJ2Cki2trcqyyCJ5TU_cDdZzVH_EDUmh&_nc_zt=14&_nc_ht=scontent.fsgn5-15.fna&_nc_gid=zfq46FnPO0ktDy8DP1mw0A&_nc_ss=7b2a8&oh=00_Af-fX82I-CfJ6a-Oq-UEBglQqVAXTqgJRVjJ8ozMBksUMw&oe=6A414FB2,
2026-06-12,"MỘT HÀNH TRÌNH VẠN DẶM, LUÔN CẦN SỰ CHUẨN BỊ ""AN"" ✨  Không ai bắt đầu một hành trình dài mà không mang theo hành trang vững chãi. Cuộc sống cũng vậy, mỗi dự định cho tương lai và gia đình đều cần một nền tảng vững vàng để chúng ta an tâm tiến bước.  Đó cũng chính là ý nghĩa mà chương trình ""Trọn Vạn Dặm An"" muốn gửi gắm: 💖 ""Trọn"" là sự chở che vẹn toàn, chăm sóc cho cả gia đình từ những bước đi đầu tiên. 🚀 ""Vạn dặm"" là hành trình tương lai dài rộng, mở ra biết bao cơ hội và trải nghiệm phía trước. 🛡️ ""An"" là sự vững tâm trọn vẹn, là điểm tựa tài chính vững vàng trên từng chặng đường ta qua.  Chủ động chuẩn bị hôm nay không chỉ là xây dựng kế hoạch bảo vệ toàn diện cho những người thân yêu, mà còn mang lại sự an lòng để tận hưởng trọn vẹn mỗi khoảnh khắc. Bởi mọi hành trình dài đều bắt đầu từ một quyết định đúng đắn.  #BaoVietNhantho #TronVungvang #TronVanDamAn",Bảo Việt Nhân Thọ,91,24,1,https://www.facebook.com/www.BaoVietNhanTho.com.vn,https://www.facebook.com/www.BaoVietNhanTho.com.vn/posts/pfbid037gq2ELPHu29MunFHnMqbhxe36vC12aVztRzjrL6oCM2eNXqbRPnCv2GcY3UzcB6Dl,https://scontent.fsgn5-15.fna.fbcdn.net/v/t39.99422-6/721516670_27391109757184533_8446277370989631976_n.png?stp=dst-jpg_tt6&cstp=mx2048x2048&ctp=s1080x2048&_nc_cat=111&ccb=1-7&_nc_sid=127cfc&_nc_ohc=jHm8ik1bilcQ7kNvwGMZiu_&_nc_oc=Adqoq0dpfqp5aNVebUbfkcKen16jk7EScyJDzf3o3ExL7fqx3-BPCLaTyfbNNYI9jiRD5KcLoZKCheIEYvTE41Do&_nc_zt=14&_nc_ht=scontent.fsgn5-15.fna&_nc_gid=eSiSeUwsOavNc2OZqNcfgg&_nc_ss=7b2a8&oh=00_Af_j1BW94hetUX0Jwr_s9sqvxbcw2dKjGD-7Zl9l4sRvnA&oe=6A417DA8,
2026-06-11,"🍀 Chúc các sĩ tử bước vào kỳ thi với tâm thế vững vàng, tự tin và quyết tâm cao nhất - Vững tin chinh phục kỳ thi!  Bảo Việt Nhân thọ đồng hành cùng các lực lượng tiếp sức mùa thi, góp phần tạo nên một kỳ thi an toàn, thuận lợi và tiếp thêm động lực cho các sĩ tử.  #TronVanDamAn #TronVungvang #BaoVietNhantho",Bảo Việt Nhân Thọ,168,33,2,https://www.facebook.com/www.BaoVietNhanTho.com.vn,https://www.facebook.com/www.BaoVietNhanTho.com.vn/posts/pfbid02XQ19yYuZMqE3QjKi75ZztQVQrMt2fGUdeZY91TZDronMvk5NzZyLW2XKWuxYvzeAl,,
2026-06-11,"KHI MỘT NGƯỜI NẰM VIỆN, CẢ GIA ĐÌNH ĐỀU PHẢI ĐIỀU CHỈNH KẾ HOẠCH   Một đợt điều trị nội trú không chỉ ảnh hưởng tới người bệnh mà còn trực tiếp tác động đến cả gia đình. Không chỉ là thời gian, công việc bị gián đoạn để chăm sóc, quý khách còn phải đối mặt với những chi phí phát sinh vô hình bên ngoài hóa đơn viện phí.  🍀 Để những ngày nằm viện không trở thành gánh nặng, sản phẩm bán kèm Trợ cấp viện phí và phẫu thuật của Bảo Việt Nhân thọ mang đến nguồn hỗ trợ tài chính thiết thực và chủ động: 👉 Trợ cấp nằm viện: Chi trả theo số ngày điều trị thực tế. 👉 Trợ cấp đặc biệt: Nhân đôi điểm tựa khi điều trị tại Khoa chăm sóc tích cực (ICU). 👉 Hỗ trợ khẩn cấp: Chi trả chi phí vận chuyển cấp cứu trong trường hợp cần thiết.  Khoản trợ cấp được chi trả độc lập với chi phí y tế thực tế, giúp gia đình bù đắp thu nhập thiếu hụt và an tâm đồng hành cùng người thân vượt qua giai đoạn khó khăn. ---------------------- ✨ Đặc biệt: Tham gia Bảo Việt Nhân thọ ngay tháng này để kiến tạo tấm lá chắn vững vàng cho tương lai, đồng thời sở hữu cơ hội trúng Ô tô, Xe máy điện VinFast thời thượng cùng hàng ngàn giải thưởng giá trị từ chương trình ""Trọn vạn dặm an""! #TronVanDamAn #TronVungvang #BaoVietNhantho",Bảo Việt Nhân Thọ,143,48,6,https://www.facebook.com/www.BaoVietNhanTho.com.vn,https://www.facebook.com/www.BaoVietNhanTho.com.vn/posts/pfbid0KUNp9H51RiaoG5qQUzpVdppiGFCqqbQfZz5smowr8A1wFL8njinwdzS8x5UEzzGml,https://scontent.fsgn5-9.fna.fbcdn.net/v/t39.99422-6/722384703_745154465346233_4082282854179584885_n.png?stp=dst-jpg_tt6&cstp=mx2048x2048&ctp=s1080x2048&_nc_cat=102&ccb=1-7&_nc_sid=127cfc&_nc_ohc=pbIluXUNoAYQ7kNvwEbL_-6&_nc_oc=AdrLQnoxrLUbmJ9sp-9ER09NFRl_OKiBNkHTD0DXG8s1jc-bXSvGt-neQl2UCdqfWwMGWO8VMwxEloi4MtHbBwOI&_nc_zt=14&_nc_ht=scontent.fsgn5-9.fna&_nc_gid=eSiSeUwsOavNc2OZqNcfgg&_nc_ss=7b2a8&oh=00_Af8L-3JehIsoKC9uaeSAVmFpWMEVUGQ6jvHVLNLRuoo5VA&oe=6A417056,
2026-06-10,"MỘT HỢP ĐỒNG – NHIỀU GIÁ TRỊ  Khi tham gia bảo hiểm nhân thọ, đích đến đầu tiên của mỗi khách hàng luôn là tấm lá chắn bảo vệ vững vàng cho gia đình. Với chương trình tri ân ""Trọn Vạn Dặm An"", một quyết định thấu đáo hôm nay còn mang lại nhiều giá trị hơn thế.  🚗 3 xe Ô tô VinFast VF6  🚗 9 xe VinFast VF3 thời thượng. 🛵 Xe máy điện VinFast Evo Grand năng động. 🎾 Bộ quà tặng Pickleball cao cấp xu hướng.  Giá trị cốt lõi của bảo hiểm nhân thọ không chỉ nằm ở một khoảnh khắc may mắn, mà là sự đồng hành bền vững, giúp bạn làm chủ mọi hành trình tương lai. Hãy để mỗi chặng đường phía trước của gia đình luôn trọn vẹn và an tâm nhất.  👉 Xem ngay chi tiết thể lệ chương trình: https://bit.ly/TronVanDamAn_fb Trọn Vạn Dặm An - Bắt đầu từ hôm nay! #TronVungvang #BaoVietNhantho #TronVanDamAn",Bảo Việt Nhân Thọ,196,86,3,https://www.facebook.com/www.BaoVietNhanTho.com.vn,https://www.facebook.com/www.BaoVietNhanTho.com.vn/posts/pfbid033r3Jk8N9rzMcFq4SSYftrjGLNxGBbjRm21Z5cp9UM4i9rjVz39Hs8pFGca6Gsrm2l,https://scontent.fsgn5-5.fna.fbcdn.net/v/t39.99422-6/719883815_865673719372653_5088308926253612457_n.png?stp=dst-jpg_tt6&cstp=mx1254x1254&ctp=s1080x2048&_nc_cat=100&ccb=1-7&_nc_sid=127cfc&_nc_ohc=_kWQmgw4PJgQ7kNvwHNLUqr&_nc_oc=AdqgPWD4wbodub7K4WhHzKRio2lHq-83uQEGt_KTCPWpuWIJfOAQEskpU52K70-0d3gduWWlDi7-7E9byhPG9hBL&_nc_zt=14&_nc_ht=scontent.fsgn5-5.fna&_nc_gid=9uXkYi0MCo7k7bp5IF82lQ&_nc_ss=7b2a8&oh=00_Af91x1yacws5MocZllE6Igz9264iL_jlmw1ih9QsnZxG8Q&oe=6A416145,
2026-06-09,"“ĐỂ TUẦN SAU ĐI KHÁM” – CUỘC HẸN DỄ BỊ TRÌ HOÃN NHẤT CỦA NGƯỜI TRƯỞNG THÀNH  Giữa bộn bề công việc và trách nhiệm gia đình, một cuộc hẹn với bác sĩ thường vô tình bị xếp sau cùng để chờ đến khi bớt bận. Tuy nhiên, sức khỏe là tài sản không nên trì hoãn, và sự bận rộn không nên trở thành rào cản ngăn bạn chủ động chăm sóc bản thân.  Thấu hiểu điều đó, An vui sống khỏe + của BVNT mang đến những giải pháp tối ưu hóa thời gian, chi phí, giúp người bận rộn dễ dàng đi khám ngay khi cần thiết: 👉 Quyền lợi ngoại trú: thanh toán chi phí khám bệnh, tiền thuốc các kỹ thuật chẩn đoán. 👉 Quyền lợi bảo lãnh viện phí: được áp dụng tại gần 300 cơ sở khám chữa bệnh trên toàn quốc.  Đừng để sự bận rộn làm trì hoãn việc chăm sóc sức khỏe cho chính bản thân mình. Hãy để An Vui Sống Khỏe+ đồng hành cùng bạn hiện thực hóa những cuộc hẹn chăm sóc sức khỏe kịp thời ngay hôm nay.  --------------------------- Đặc biệt: Tham gia Bảo Việt Nhân thọ ngay tháng này để kiến tạo tấm lá chắn vững vàng cho tương lai, đồng thời sở hữu cơ hội trúng Ô tô, Xe máy điện VinFast thời thượng cùng hàng ngàn giải thưởng giá trị từ chương trình ""Trọn vạn dặm an""! #TronVungvang #BaoVietNhantho #TronVanDamAn #AnVuiSongKhoe",Bảo Việt Nhân Thọ,64,21,0,https://www.facebook.com/www.BaoVietNhanTho.com.vn,https://www.facebook.com/www.BaoVietNhanTho.com.vn/posts/pfbid0GE6gBsuYvEpGSADZiUfn83kZzsKwhRpVdB4Wb63rpgZP6k2a6zQeo7tivmn8x3zal,https://scontent.fsgn5-5.fna.fbcdn.net/v/t39.99422-6/718792989_988001597337847_1761943502447834199_n.png?stp=dst-jpg_tt6&cstp=mx1241x1241&ctp=s1080x2048&_nc_cat=100&ccb=1-7&_nc_sid=127cfc&_nc_ohc=id7k0JUhx5cQ7kNvwEPI5vC&_nc_oc=Adq24Jhnqf09raVfSl9iUhYAJIyAU8Jk_wrlvRQH7dH_Lik5hSXhEeJMnm-zuw15OkOB-Bae16uJpn-B2c86gBh7&_nc_zt=14&_nc_ht=scontent.fsgn5-5.fna&_nc_gid=9uXkYi0MCo7k7bp5IF82lQ&_nc_ss=7b2a8&oh=00_Af-n1zsZ0fUsqOutZvArlaFR_mA_NY6Rz6O1lMhuZDA3oQ&oe=6A417C82,
2026-06-08,"9 CHIẾC Ô TÔ VINFAST: CƠ HỘI NGAY TRONG TẦM TAY! Cơ hội để trở thành một trong những chủ nhân may mắn sở hữu 09 chiếc ô tô VinFast thời thượng từ chương trình ""Trọn Vạn Dặm An""!  🍀 Nhân cột mốc 30 năm đồng hành và bảo vệ hàng triệu gia đình Việt, Bảo Việt Nhân thọ mang đến chương trình tri ân quy mô lớn với dàn ""xế hộp"" cực khủng:  🎁 03 xe VinFast VF6 – Thời thượng và tiện nghi  🎁 06 xe VinFast VF3 – Năng động và cá tính  Tấm vé may mắn hoàn toàn có thể thuộc về chính bạn. Đừng bỏ lỡ cơ hội nhận ""quà kép"" – vừa an tâm bảo vệ gia đình trước mọi rủi ro, vừa có cơ hội rinh xe sang về nhà!  👉 Xem ngay chi tiết thể lệ chương trình: https://bit.ly/TronVanDamAn_fb Trọn Vạn Dặm An - Bắt đầu từ hôm nay! #TronVungvang #BaoVietNhantho #TronVanDamAn",Bảo Việt Nhân Thọ,126,53,7,https://www.facebook.com/www.BaoVietNhanTho.com.vn,https://www.facebook.com/www.BaoVietNhanTho.com.vn/posts/pfbid02LDd7hYghU4ep7ndooPMVhfcTsDLzMYaTPz4NhhRgC1Yht47qrAmCwMHXRezeNjGtl,https://scontent.fsgn5-13.fna.fbcdn.net/v/t39.99422-6/718014516_1459060502643694_9051081229705978082_n.png?stp=dst-jpg_tt6&cstp=mx1241x1241&ctp=s1080x2048&_nc_cat=106&ccb=1-7&_nc_sid=127cfc&_nc_ohc=yAjxdYt4QIIQ7kNvwG1mvX6&_nc_oc=AdpcxlYaxxqAoIZlnrbBxeKqxFTpuBau9g8BWHaTLQXxCjTM9lbtv4_NBxwCOJZeRtSWrwQuoyO8nF3tfr86xeDz&_nc_zt=14&_nc_ht=scontent.fsgn5-13.fna&_nc_gid=9uXkYi0MCo7k7bp5IF82lQ&_nc_ss=7b2a8&oh=00_Af_g22-3vuat0IGQsi21jGVoI3XvtBPA2cIbjj14LYd6Ag&oe=6A41818C,
2026-06-05,"🔥 MINIGAME: THỬ TÀI TINH Ý – RINH QUÀ NHƯ Ý  Trong không khí hân hoan mừng cột mốc 30 năm và ra mắt chương trình tri ân lớn nhất năm ""Trọn Vạn Dặm An"", cùng Bảo Việt Nhân thọ tham gia minigame thú vị – xem kỹ, trả lời nhanh, rinh quà liền tay!  ❓ Câu hỏi minigame: Theo 2 người vợ trong video, Bộ quà túi và vợt Pickleball của chương trình mang họa tiết gì biểu tượng cho tinh thần Việt?  🎬 Cách tham gia cực đơn giản: 👉 Bước 1: Like và theo dõi Fanpage Bảo Việt Nhân thọ. 👉 Bước 2: Xem & Like video Chương trình tri ân “Trọn Vạn Dặm An” (link video ở phần bình luận) 👉 Bước 3: Bình luận theo cú pháp: [Đáp án câu hỏi] + tag 02 người bạn + 01 số may mắn từ 0–999  🎁 05 phần quà sẽ được trao theo thứ tự ưu tiên: (1) Câu trả lời đúng (2) Số may mắn trùng/gần đáp án (3) Thời gian trả lời sớm hơn  ⏰ Thời gian tham gia: Đến hết ngày 7/6/2026. 📌 Lưu ý: Mỗi tài khoản được tham gia nhiều lần để tăng cơ hội nhận quà.  💙 Nhanh tay tham gia, rủ bạn bè cùng khám phá video “Trọn Vạn Dặm An” để rinh quà từ  Bảo Việt Nhân thọ!  #BaoVietNhantho #TronVanDamAn",Bảo Việt Nhân Thọ,274,124,411,https://www.facebook.com/www.BaoVietNhanTho.com.vn,https://www.facebook.com/www.BaoVietNhanTho.com.vn/posts/pfbid0ELfpcofNh93p8c75RD7FBLFamALYuA3kRzKuiFwUcLPa9fWyrQ1q9ffXDgRHqByVl,https://scontent.fsgn5-6.fna.fbcdn.net/v/t39.30808-6/711946482_1056205140063093_4463951335015032629_n.jpg?stp=dst-jpg_tt6&cstp=mx1241x1241&ctp=s1080x2048&_nc_cat=108&ccb=1-7&_nc_sid=127cfc&_nc_ohc=Y168ncS3myIQ7kNvwFjCE7-&_nc_oc=Adqxv60Jy1vh70rz90PZHDwWm7sGXnYd26xhlyNcXcL-sDuFKlBIDuZk5mg-xAucYU9ekO-3Jq2W7epUci_qXnEn&_nc_zt=23&_nc_ht=scontent.fsgn5-6.fna&_nc_gid=MZZyJLl2wtXZ9eXj9hXQ1g&_nc_ss=7b2a8&oh=00_Af9EIxbQCu9e42XKHsY2vLSXFcgZH-8jAiKNWTU2NpvncA&oe=6A415C4D,
2026-06-04,"🌿 CHÚC MỪNG NGÀY MÔI TRƯỜNG THẾ GIỚI 05/06   Mỗi hành động nhỏ hôm nay, từ tiết kiệm điện đến lựa chọn phương tiện thân thiện với môi trường, đều góp phần xây dựng một môi trường sống tốt hơn.  💙 Hưởng ứng Ngày Môi trường Thế giới, Bảo Việt Nhân thọ mong muốn lan tỏa tinh thần sống xanh, bảo vệ sớm vì cộng đồng và thế hệ tương lai.  🎉 Đặc biệt, với chương trình tri ân “Trọn Vạn Dặm An” kỷ niệm 30 năm Bảo Việt Nhân thọ, khách hàng không chỉ được bảo vệ vững vàng, mà còn có cơ hội sở hữu những phương tiện di chuyển xanh hiện đại như Ô tô điện VinFast VF3, VF6 và Xe máy điện VinFast!  #BaoVietNhantho #TronVanDamAn",Bảo Việt Nhân Thọ,73,18,1,https://www.facebook.com/www.BaoVietNhanTho.com.vn,https://www.facebook.com/www.BaoVietNhanTho.com.vn/posts/pfbid02notVfd3yuKongHGezkSotNQ66UrE7n2LSSNzZhEezyFiLxnzSfyZnCA5tvzF4qezl,https://scontent.fsgn5-9.fna.fbcdn.net/v/t39.30808-6/714599630_1055737870109820_3373338563924676154_n.jpg?stp=dst-jpg_tt6&cstp=mx1241x1241&ctp=s1080x2048&_nc_cat=102&ccb=1-7&_nc_sid=833d8c&_nc_ohc=gxRy82OBBOoQ7kNvwEHiXMW&_nc_oc=Ado_z-u3SnJofeSUJzrEeW9Uc9-0ZVXC1cugZUwMapP7hX9qrmvoWUqII-944H-xQ_RW66DxUmyegApvoldHFFMe&_nc_zt=23&_nc_ht=scontent.fsgn5-9.fna&_nc_gid=MZZyJLl2wtXZ9eXj9hXQ1g&_nc_ss=7b2a8&oh=00_Af_tRFF2q2sAoAPswXFsMGW_q4OmWBM35jvzHE6O0Xn9uA&oe=6A414E48,
2026-06-04,"🔥 TUẦN LỄ VÀNG – THAM GIA 1 HỢP ĐỒNG, HƯỞNG KÉP ƯU ĐÃI 🔥  Từ nay đến hết ngày 15/06/2026 là giai đoạn đặc biệt khi khách hàng tham gia bảo hiểm tại Bảo Việt Nhân thọ có cơ hội nhận quyền lợi từ cả hai chương trình tri ân lớn.  🚗 Với Trọn Vạn Dặm An, khách hàng có cơ hội tham gia quay thưởng hệ sinh thái xe điện VinFast gồm VinFast VF6, VinFast VF3 và VinFast Evo Grand. Bên cạnh đó, khách hàng đủ điều kiện còn được nhận bộ quà tặng Túi và vợt Pickleball cao cấp.  🎁 Với Trọn Lễ An Vui, khách hàng sẽ nhận thêm quà tặng độc quyền là Túi da cao cấp họa tiết trống đồng hoặc Combo quà tặng tiện ích dành cho cuộc sống thường ngày.  Một kế hoạch bảo vệ cho tương lai, cùng lúc nhận thêm nhiều giá trị thiết thực dành cho bản thân và gia đình.  ⏳ Cơ hội hưởng đồng thời cả hai chương trình chỉ kéo dài đến hết ngày 15/06/2026. #BaoVietNhantho #TronVungvang #TronVanDamAn",Bảo Việt Nhân Thọ,146,63,7,https://www.facebook.com/www.BaoVietNhanTho.com.vn,https://www.facebook.com/www.BaoVietNhanTho.com.vn/posts/pfbid02vTVxcrnWwTTdrdv1CG6foqtfoPtnUoU7Bc3MU9yvVRWaDt7rYWQJM5cKmDrEZ8nal,https://scontent.fsgn5-15.fna.fbcdn.net/v/t39.30808-6/710497597_1055103940173213_1540618737880873235_n.jpg?stp=dst-jpg_tt6&cstp=mx1241x1241&ctp=s1080x2048&_nc_cat=111&ccb=1-7&_nc_sid=833d8c&_nc_ohc=p3pfyu6P9bgQ7kNvwE_2dQE&_nc_oc=Adpr1ltstK_mYh7SfuUeddbk7tY7YQAuMLQ9CPWBGBJ3mIKddLryIuOm7KF_smfPbPe9aQgUA7NMiEHFkhXFAhKL&_nc_zt=23&_nc_ht=scontent.fsgn5-15.fna&_nc_gid=MZZyJLl2wtXZ9eXj9hXQ1g&_nc_ss=7b2a8&oh=00_Af9ZX67nOsvHQiA3YPiZm0rlpOfV3acnPpePiP2hkMJ4yA&oe=6A415E59,
2026-06-03,"🎉 TRI ÂN 30 NĂM ĐỒNG HÀNH – 5.000 BỘ QUÀ TẶNG TÚI VÀ VỢT PICKLEBALL DÀNH TẶNG KHÁCH HÀNG  Nhân dịp kỷ niệm 30 năm thành lập, Bảo Việt Nhân thọ triển khai chương trình tri ân ""Trọn Vạn Dặm An"" như lời cảm ơn chân thành gửi tới những khách hàng đã tin tưởng và đồng hành cùng chúng tôi trên hành trình xây dựng tương lai an tâm, vững vàng.  🎁 5.000 bộ quà tặng Túi và Vợt Pickleball cao cấp đã sẵn sàng dành cho khách hàng tham gia hợp đồng mới.  Pickleball là môn thể thao được yêu thích bởi những người lựa chọn lối sống chủ động: giữ gìn sức khỏe, duy trì năng lượng tích cực và không ngừng chuẩn bị cho tương lai. Đó cũng chính là tinh thần mà Bảo Việt Nhân thọ luôn hướng tới trong suốt 30 năm qua. Bởi một tương lai vững vàng luôn bắt đầu từ những lựa chọn chủ động hôm nay.  ✔️ Áp dụng cho khách hàng tham gia hợp đồng mới có phí bảo hiểm hàng năm từ 22 triệu đồng và đáp ứng điều kiện chương trình. 👉 Xem ngay chi tiết thể lệ chương trình: https://bit.ly/TronVanDamAn_fb Trọn Vạn Dặm An - Bắt đầu từ hôm nay! #TronVungvang #BaoVietNhantho #TronVanDamAn",Bảo Việt Nhân Thọ,134,41,2,https://www.facebook.com/www.BaoVietNhanTho.com.vn,https://www.facebook.com/www.BaoVietNhanTho.com.vn/posts/pfbid02nzNYyqsFBtZ6GYZb7b8ahWQTpvJTNmAJn41PGRecsNNK8GFD5WtQMhPEabFGnmfCl,https://scontent.fsgn5-21.fna.fbcdn.net/v/t39.30808-6/711848093_1054218953595045_6817422922938621351_n.jpg?stp=dst-jpg_tt6&cstp=mx2048x2048&ctp=s1080x2048&_nc_cat=109&ccb=1-7&_nc_sid=127cfc&_nc_ohc=aiwDYP0mQTwQ7kNvwHLEzdl&_nc_oc=Adq__O2B7tRoiImZzSh_hAF72lV9YYGsfGI6lk64jAJz5owjNLKAC3l6fhojMMPhskQgbbTWLqfiPxhgiJcPnfvu&_nc_zt=23&_nc_ht=scontent.fsgn5-21.fna&_nc_gid=XNO3YNjLGZfYc08Kp8RviA&_nc_ss=7b2a8&oh=00_Af9RGR224rnKoJjsf7uJP3dthzJ-zWi9OfaP3vDBXqpLiQ&oe=6A4169AC,
2026-06-02,"🎉 “TRỌN VẠN DẶM AN” - CƠ HỘI NHẬN 2 PHẦN THƯỞNG GIÁ TRỊ CHỈ VỚI 1 HỢP ĐỒNG  30 năm - hành trình được xây đắp từ niềm tin của hàng triệu gia đình Việt dành cho Thương hiệu Bảo hiểm nhân thọ Quốc gia. Nhân dấu mốc kỷ niệm 30 năm, Bảo Việt Nhân thọ triển khai chương trình “Trọn vạn dặm an” - lời tri ân ý nghĩa dành cho sự tin tưởng, gắn bó và đồng hành của Quý khách hàng trong suốt chặng đường qua.  💙 Chỉ với 01 hợp đồng bảo hiểm nhân thọ đủ điều kiện, khách hàng không chỉ được bảo vệ vững vàng cho tương lai mà còn có cơ hội nhận 2 phần thưởng giá trị: 🎁 Bộ quà tặng túi và vợt Pickleball  🎁 Mã quay thưởng với cơ hội sở hữu: 🚗 03 ô tô VinFast VF6 Eco 🚗 06 ô tô VinFast VF3 Eco 🛵 30 xe máy điện VinFast Evo Grand  📅 Thời gian áp dụng: Từ ngày 01/06/2026 đến hết ngày 31/08/2026. 👉 Chi tiết chương trình xem tại bình luận.  Trọn vạn dặm an - Bắt đầu từ hôm nay!  #BaoVietNhanTho #TronVanDamAn",Bảo Việt Nhân Thọ,188,119,3,https://www.facebook.com/www.BaoVietNhanTho.com.vn,https://www.facebook.com/reel/1561370652073974/,,https://www.facebook.com/reel/1561370652073974/
2026-06-02,"🎉 TRỌN AN TÂM và CƠ HỘI NHẬN Ô TÔ, XE MÁY GIÁ TRỊ TRONG CHƯƠNG TRÌNH ""TRỌN VẠN DẶM AN""   Hành trình 30 năm vững vàng của Bảo Việt Nhân thọ được viết nên bởi sự tin yêu của quý khách. Thay lời tri ân sâu sắc, chương trình ""Trọn Vạn Dặm An"" mang đến những món quà giá trị thay cho lời chúc an yên và cam kết tiếp tục đồng hành cùng bạn trên mọi nẻo đường tương lai.  🚗 03 ô tô VinFast VF6 Eco – Giải Trọn Gắn Kết 🚗 06 ô tô VinFast VF3 Eco – Giải Trọn An Tâm 🛵 30 xe máy điện VinFast Evo Grand – Giải Trọn Đồng Hành  🎫 Với mức phí bảo hiểm hàng năm từ 20 triệu đồng, khách hàng sẽ được cấp mã quay thưởng tham gia chương trình. Mức phí càng cao, số lượng mã càng nhiều.  Đặc biệt, khách hàng hiện hữu tham gia hợp đồng mới sẽ được nhân đôi số mã quay thưởng, nhân đôi cơ hội nhận quà hấp dẫn.  👉 Xem ngay chi tiết thể lệ chương trình: https://bit.ly/TronVanDamAn_fb Trọn Vạn Dặm An - Bắt đầu từ hôm nay!  #TronVungvang #BaoVietNhantho #TronVanDamAn",Bảo Việt Nhân Thọ,100,55,4,https://www.facebook.com/www.BaoVietNhanTho.com.vn,https://www.facebook.com/www.BaoVietNhanTho.com.vn/posts/pfbid02GRTPxy93sjZckFkiGWeX5kX5TfFaP2VrbvP1K3KgV4YDS7KJcue7j2sTQwah8Hicl,,
2026-06-01,"🎉 MỪNG BẢO VIỆT NHÂN THỌ 30 TUỔI - TRI ÂN QUÀ KHỦNG HƠN 11 TỶ ĐỒNG!  Đánh dấu hành trình 30 năm hình thành và phát triển, Bảo Việt Nhân thọ xin gửi lời tri ân sâu sắc nhất đến hàng triệu gia đình Việt bằng chương trình tri ân LỚN NHẤT NĂM: ""Trọn Vạn Dặm An"".  ▶️ Bấm xem ngay video để không bỏ lỡ những cơ hội rinh Ô tô Vinfast Vf6 về nhà! #BaoVietNhantho #TronVungvang #TronVanDamAn #Batdautuhomnay",Bảo Việt Nhân Thọ,592,368,34,https://www.facebook.com/www.BaoVietNhanTho.com.vn,https://www.facebook.com/reel/958598713656250/,,https://www.facebook.com/reel/958598713656250/
2026-06-01,"CHƯƠNG TRÌNH TRI ÂN LỚN NHẤT NĂM “TRỌN VẠN DẶM AN” - MỪNG SINH NHẬT 30 NĂM BẢO VIỆT NHÂN THỌ   Nhân dịp kỷ niệm 30 năm thành lập, Bảo Việt Nhân thọ chính thức triển khai chương trình tri ân lớn nhất năm mang tên ""Trọn Vạn Dặm An"" với tổng giá trị giải thưởng lên tới 11 tỷ đồng.  🎁 Khi tham gia chương trình, khách hàng sẽ nhận ngay bộ quà tặng túi và vợt pickleball, đồng thời nhận mã quay thưởng với cơ hội sở hữu những giải thưởng hấp dẫn: 🚗 03 ô tô VinFast VF6 Eco 🚗 06 ô tô VinFast VF3 Eco 🛵 30 xe máy điện VinFast Evo Grand 📅 Thời gian áp dụng: Từ ngày 01/06/2026 đến hết ngày 31/08/2026. 👉 Chi tiết chương trình xem tại bình luận Trọn Vạn Dặm An – dấu mốc tri ân đặc biệt trên hành trình 30 năm, tiếp nối sứ mệnh lan tỏa giá trị an tâm và đồng hành cùng khách hàng trên mọi chặng đường tương lai.  #BaoVietNhantho #TronVungvang #TronVanDamAn",Bảo Việt Nhân Thọ,352,169,7,https://www.facebook.com/www.BaoVietNhanTho.com.vn,https://www.facebook.com/www.BaoVietNhanTho.com.vn/posts/pfbid02AxrZnCXJhAdPWRZxKQvVyXryKEk1Gv1Ntju8xqJPGfc9LDFQxQaP2bKGRYCE6JvVl,,
