post_date,content,fanpage_name,reaction,share,comment,fanpage_url,post_url,image_urls,video_url
2026-06-24,"⏱️ 10 phút có thể thay đổi điều gì? 10 phút cho một cuộc gọi quan trọng. 10 phút để hoàn thành một giao dịch. 10 phút để đưa ra một quyết định cho tương lai. Có những điều chỉ diễn ra trong vài phút, nhưng giá trị có thể kéo dài nhiều năm sau đó.  ❤️ Và đôi khi, chỉ với một khoảng thời gian ngắn, một kế hoạch bảo vệ cũng có thể được kích hoạt để đồng hành cùng bạn trước những điều không thể dự đoán trong cuộc sống. 📅 Chờ đón vào ngày mai - Một giải pháp mới sẽ chính thức được bật mí.  #BaoVietNhantho #lifecare2_0",Bảo Việt Nhân Thọ,35,5,0,https://www.facebook.com/www.BaoVietNhanTho.com.vn,https://www.facebook.com/www.BaoVietNhanTho.com.vn/posts/pfbid02AKBGiH94QM3cBV7yJV1ckmTbxshZpBScMrxgMq8FSfzShdss3hMfyD6ukDW4AmMdl,https://scontent.fsgn5-14.fna.fbcdn.net/v/t39.99422-6/727497554_1710727413600795_3105038972452357125_n.png?stp=dst-jpg_tt6&cstp=mx2000x2000&ctp=s1080x2048&_nc_cat=101&ccb=1-7&_nc_sid=127cfc&_nc_ohc=GLJQUUuGxKEQ7kNvwF9lm8N&_nc_oc=AdpkpCUzZ9mWFsdGmGJnj7jLmbPh_Egl5bb6Kzj6on6YUykpyx2kwA0oY-gLv1wnJyDK5ePgLxUziDl6Y2M6Yolx&_nc_zt=14&_nc_ht=scontent.fsgn5-14.fna&_nc_gid=eY7vZotZdcp1kcRajaxDjw&_nc_ss=7b2a8&oh=00_Af8KHgmz3Et6qQ5UOsFWRWMO-TRqgyt-SFgPPfneaUe8lQ&oe=6A417CD8,
2026-06-24,"🌱 XUÂN KHỞI – KHỞI ĐẦU CHO HÀNH TRÌNH AN THỊNH Mỗi hành trình dài đều bắt đầu từ một nền tảng vững chắc. Cũng như mùa xuân là thời điểm gieo những hạt mầm đầu tiên cho một năm trọn vẹn, việc chuẩn bị kế hoạch bảo vệ và tài chính từ sớm là bước khởi đầu để vun đắp tương lai đủ đầy cho bản thân và gia đình.  An Thịnh Phúc Niên được thiết kế với sự linh hoạt ngay từ giai đoạn khởi đầu:  🌿 Linh hoạt lựa chọn thời hạn bảo hiểm: 20 năm, 25 năm, 30 năm hoặc đến 90 tuổi. 🌿 Linh hoạt đóng phí bảo hiểm sau 4 năm hợp đồng đầu tiên. 🌿 Tùy chọn tham gia thêm các sản phẩm bán kèm đa dạng để gia tăng bảo vệ theo nhu cầu.  Một khởi đầu được chuẩn bị chu đáo hôm nay chính là nền tảng cho những giá trị được vun đắp bền vững trong tương lai.  An Thịnh Phúc Niên – Vun đắp đường dài, viên mãn mai sau. Chi tiết sản phẩm xem tại: https://bit.ly/AnThinhPhucNien_fb  #BaoVietNhantho #AnThinhPhucNien #TronVanDamAn",Bảo Việt Nhân Thọ,39,15,0,https://www.facebook.com/www.BaoVietNhanTho.com.vn,https://www.facebook.com/reel/1017180014020017/,,https://www.facebook.com/reel/1017180014020017/
2026-06-23,"MINIGAME 30 NĂM BẢO VIỆT NHÂN THỌ 🎉 💙 Cùng Bảo Việt Nhân thọ khám phá thông điệp đặc biệt và thử vận may với minigame Bắt trọn khoảnh khắc, rinh về những phần quà ý nghĩa!  🎬 Cách tham gia: Bạn hãy xem và dừng video đúng khoảnh khắc thông điệp xuất hiện trên màn hình. 👉 Bước 1: Like bài viết. 👉 Bước 2: Bình luận vào bài viết theo cú pháp: [Thông điệp xuất hiện trên màn hình] + tag 2 người bạn + [Số may mắn từ 0 - 999] 🎁 05 phần quà may mắn sẽ được trao cho những người tham gia hợp lệ theo thứ tự ưu tiên: ✅ Trả lời đúng thông điệp ✅ Có số may mắn trùng hoặc gần nhất với kết quả quay số ✅ Bình luận sớm hơn  ⏰ Thời gian tham gia: Từ 22/6 đến hết ngày 25/6/2026. 💙 Khám phá thông điệp 30 năm cùng Bảo Việt Nhân thọ và nhận cơ hội rinh quà ngay hôm nay!  #BaoVietNhantho",Bảo Việt Nhân Thọ,392,76,202,https://www.facebook.com/www.BaoVietNhanTho.com.vn,https://www.facebook.com/reel/1025908676626703/,,https://www.facebook.com/reel/1025908676626703/
2026-06-23,"🎉 CÔNG BỐ KẾT QUẢ MINIGAME: THỬ TÀI TINH Ý – RINH QUÀ NHƯ Ý 🎉 Xin chúc mừng các khách hàng may mắn đã trúng thưởng trong minigame ""Thử Tài Tinh Ý – Rinh Quà Như Ý"". ❤️ Cảm ơn Quý khách đã nhiệt tình tham gia chương trình và đồng hành cùng Bảo Việt Nhân thọ. 📩 Các khách hàng trúng thưởng vui lòng kiểm tra tin nhắn từ Fanpage để xác nhận thông tin nhận quà. Hẹn gặp lại Quý khách trong những minigame hấp dẫn tiếp theo!  #BaoVietNhantho #TronVanDamAn #AnThinhPhucNien",Bảo Việt Nhân Thọ,64,4,10,https://www.facebook.com/www.BaoVietNhanTho.com.vn,https://www.facebook.com/www.BaoVietNhanTho.com.vn/posts/pfbid02nt3An66KLkZ1NgoostzpLYiH8CYteMZbUhwq9AMmnrP9KsUW9ttGjSENuTb1yd4fl,https://scontent.fsgn5-11.fna.fbcdn.net/v/t39.99422-6/730015722_1540405334281863_2050876411921286386_n.png?stp=dst-jpg_tt6&cstp=mx2000x2000&ctp=s1080x2048&_nc_cat=110&ccb=1-7&_nc_sid=127cfc&_nc_ohc=Kad87BgnfbIQ7kNvwESwRaL&_nc_oc=AdrsldAQoB8pKQCkmgvK-VrOGhAC-YCmmh-qCdHSn4xCTV_LZckMb9OWpZ7c6bEoM2rAkbdlRbzoimQ4o8hIcE08&_nc_zt=14&_nc_ht=scontent.fsgn5-11.fna&_nc_gid=jWN42Po2jpvW7Ibhu4Taug&_nc_ss=7b2a8&oh=00_Af-Hk2R2BXeKCxijZMcR1gwScMziVX6DOmnZRxFzO_Ab6g&oe=6A415918,
2026-06-23,"🎉 30 NĂM GẮN KẾT – VẠN QUÀ TẶNG TRI ÂN 🎁 Bước sang tuổi 30, Bảo Việt Nhân thọ trân trọng gửi tới Quý khách những món quà tri ân thay lời cảm ơn vì đã tin tưởng lựa chọn và đồng hành cùng chúng tôi trong suốt thời gian qua.  ❤ Từ 22/06 – 15/07/2026, khách hàng đến các Công ty thành viên/Văn phòng khu vực của Bảo Việt Nhân thọ trên toàn quốc và thực hiện các giao dịch liên quan đến hợp đồng như cập nhật thông tin, đóng phí, cài đặt hoặc giao dịch trên MyBVLife... sẽ nhận ngay 01 túi đay thân thiện với môi trường. Đây cũng là dịp để Quý khách kiểm tra và cập nhật thông tin hợp đồng, giúp nâng cao bảo mật và thuận tiện hơn trong quá trình sử dụng dịch vụ. 📍 Hãy ghé Văn phòng Bảo Việt Nhân thọ gần nhất để nhận quà tri ân và được hỗ trợ tận tình. 👉 Xem chi tiết chương trình tại: https://www.baovietnhantho.com.vn/tin-tuc/chuong-trinh-tri-an-30-nam-gan-ket-van-qua-tang-tri-an  #BaoVietNhantho #AnThinhPhucNien #TronVanDamAn",Bảo Việt Nhân Thọ,73,17,2,https://www.facebook.com/www.BaoVietNhanTho.com.vn,https://www.facebook.com/www.BaoVietNhanTho.com.vn/posts/pfbid0nLNLfmkwPR4vaungsZhSYzHM6TckRnch1UiMdx8jzHY2ogQhT1jUbinBTqYYZ1TDl,https://scontent.fsgn5-13.fna.fbcdn.net/v/t39.99422-6/728543912_1007161945347557_334781982851547181_n.png?stp=dst-jpg_tt6&cstp=mx1300x1300&ctp=s1080x2048&_nc_cat=106&ccb=1-7&_nc_sid=127cfc&_nc_ohc=Kh6rh5-jp7wQ7kNvwFMfuDp&_nc_oc=AdrWGSH-1b3MEvbAep4OlvDzQb1Ek_qTejFH5zojL_2hiqn6t-10lknAJqpBm4XxtrDi3YZkOwmOvX2YYZgfZFAB&_nc_zt=14&_nc_ht=scontent.fsgn5-13.fna&_nc_gid=cYY3191hrdH-NIRaWvK_QQ&_nc_ss=7b2a8&oh=00_Af-qm3wwhiXhGI0NPY4QFD37NeBckVOSqEUByR5lwctRBg&oe=6A416512,
2026-06-22,"BẢO VIỆT NHÂN THỌ – 30 NĂM TRỌN NIỀM TIN THƯƠNG HIỆU VIỆT (22/06/1996 – 22/06/2026)  Ba mươi năm trước, Bảo Việt Nhân thọ đặt những viên gạch đầu tiên cho thị trường bảo hiểm nhân thọ Việt Nam. Ba mươi năm sau, hành trình ấy đã trở thành niềm tin của hàng triệu gia đình Việt.  🍀 Là doanh nghiệp tiên phong khai mở thị trường bảo hiểm nhân thọ tại Việt Nam, Bảo Việt Nhân thọ luôn kiên định với sứ mệnh phụng sự người Việt bằng những giải pháp bảo vệ tài chính nhân văn và bền vững. Từ những ngày đầu thành lập đến hôm nay, Bảo Việt Nhân thọ không ngừng đổi mới, nâng cao chất lượng dịch vụ, mở rộng mạng lưới phục vụ trên khắp cả nước và đồng hành cùng khách hàng trong hành trình bảo vệ, tích lũy và hoạch định tương lai.  🍀 Ba thập kỷ phát triển đã tạo dựng nên một thương hiệu giàu bản sắc Việt, được vun đắp bởi sự tận tâm của nhiều thế hệ cán bộ, tư vấn viên và trên hết là sự tin tưởng của hàng triệu khách hàng trên mọi miền đất nước. Chính niềm tin ấy đã trở thành nền tảng vững chắc để Bảo Việt Nhân thọ phát triển bền vững, giữ vững vị thế dẫn đầu thị trường và khẳng định giá trị của một thương hiệu bảo hiểm nhân thọ của người Việt, vì người Việt.  ❤️ Nhân dịp kỷ niệm 30 năm thành lập, Bảo Việt Nhân thọ xin gửi lời tri ân sâu sắc tới hàng triệu khách hàng đã tin tưởng lựa chọn và đồng hành cùng chúng tôi trong suốt chặng đường vừa qua. Sự tin yêu của Quý khách hàng không chỉ là động lực để Bảo Việt Nhân thọ không ngừng phát triển, mà còn góp phần xây dựng và lan tỏa niềm tự hào về một thương hiệu bảo hiểm nhân thọ Việt Nam vững mạnh.  ❤️ Trân trọng cảm ơn Quý đối tác cùng các thế hệ cán bộ, tư vấn viên trên toàn hệ thống đã chung sức xây dựng và phát triển Bảo Việt Nhân thọ trở thành thương hiệu bảo hiểm nhân thọ Quốc gia.  30 năm là dấu mốc đầy tự hào và cũng là điểm khởi đầu cho một hành trình mới với khát vọng tiếp tục phụng sự người Việt, kiến tạo những giá trị bền vững cho gia đình và xã hội.  Bảo Việt Nhân thọ – 30 năm Trọn niềm tin Thương hiệu Việt. #BaoVietNhantho #TronVungvang #TronVanDamAn #AnThinhPhucNien",Bảo Việt Nhân Thọ,288,57,12,https://www.facebook.com/www.BaoVietNhanTho.com.vn,https://www.facebook.com/www.BaoVietNhanTho.com.vn/posts/pfbid0ehmLG9GFJVrvpxykjkAKrz86bR8a9RNJ5iay9JsHWtCnSeTxcizs6p2CxxKWCq9l,https://scontent.fsgn5-2.fna.fbcdn.net/v/t39.99422-6/728726951_1411989420726445_7746322123573467699_n.png?stp=dst-jpg_tt6&cstp=mx2048x2048&ctp=s1080x2048&_nc_cat=105&ccb=1-7&_nc_sid=127cfc&_nc_ohc=jLxtaAcSEacQ7kNvwHcMRu-&_nc_oc=AdpIIF1_pwrDboOwQ8OyMTxAHu-JA4Vdi2IthgtF8JVQ6KXi1BFqwzhR-8cKtF1vH1rVdEsySlTWwk3mQ0GXxcQx&_nc_zt=14&_nc_ht=scontent.fsgn5-2.fna&_nc_gid=cYY3191hrdH-NIRaWvK_QQ&_nc_ss=7b2a8&oh=00_Af-LGrCmxS1kmh0QCuDJmzoPECeSKehXtXzrTsIte3FiqQ&oe=6A415C63,
2026-06-22,BẢO VIỆT NHÂN THỌ - 30 NĂM TRỌN NIỀM TIN THƯƠNG HIỆU VIỆT (22/06/1996 – 22/06/2026) #BaoVietNhantho #TronVungvang #TronVanDamAn #AnThinhPhucNien,Bảo Việt Nhân Thọ,409,151,23,https://www.facebook.com/www.BaoVietNhanTho.com.vn,https://www.facebook.com/reel/1498020321650629/,,https://www.facebook.com/reel/1498020321650629/
2026-06-21,"Chúc mừng Ngày Báo chí Cách mạng Việt Nam 21/6 🖋️ Đằng sau mỗi dòng tin tức, mỗi thước phim thời sự và những trang viết giá trị là hành trình lao động bền bỉ, dấn thân đầy trách nhiệm của những người làm báo để giữ vững dòng chảy thông tin, phản ánh hơi thở của thời đại. ❤ Nhân Ngày Báo chí Cách mạng Việt Nam 21/6, Bảo Việt Nhân thọ xin gửi lời chúc mừng tới Quý Nhà báo, Phóng viên, Biên tập viên. Kính chúc Quý vị luôn giữ vững bản lĩnh và tinh thần cống hiến, giữ trọn ngọn lửa đam mê với nghề để tiếp tục mang đến những trang viết sắc bén đồng hành cùng đất nước bước vào kỷ nguyên vươn mình của dân tộc!  #BaoVietNhantho",Bảo Việt Nhân Thọ,95,9,0,https://www.facebook.com/www.BaoVietNhanTho.com.vn,https://www.facebook.com/www.BaoVietNhanTho.com.vn/posts/pfbid02B19cFh1g2cJC43TwJKM4zGiYpog4bk1EEpGkdB2AUVwyFhx9As8Gn3VgidWEGyhtl,https://scontent.fsgn5-2.fna.fbcdn.net/v/t39.99422-6/728004286_1862345498055380_2457589646294011698_n.png?stp=dst-jpg_tt6&cstp=mx1875x1875&ctp=s1080x2048&_nc_cat=105&ccb=1-7&_nc_sid=127cfc&_nc_ohc=O7rVRE4TGFYQ7kNvwGAnckq&_nc_oc=AdrTDePiHD3AwocDg_LfWU2imAtZXwxxaK34lpmr2qtIUhd8-UPCHc4ZWnSkNTeoS6f_5BFUFov5ZJ1v7X9XWYFW&_nc_zt=14&_nc_ht=scontent.fsgn5-2.fna&_nc_gid=5vH5IJSYZ_XYWEc01qYwyQ&_nc_ss=7b2a8&oh=00_Af9LJ55rbIvs2o38ZuJfzU8Ia8o7e5_aDIdGmbXtt5nBxw&oe=6A417279,
2026-06-20,"❤ Đằng sau sự bình yên của mái ấm là đôi vai gánh vác thầm lặng của cha. Người luôn lo toan cho tương lai của gia đình từ rất sớm, sẵn sàng gác lại những mong muốn riêng để dành trọn cơ hội tốt đẹp nhất cho con cái. ❤ Nhân Ngày của Cha, Bảo Việt Nhân thọ xin gửi lời tri ân sâu sắc nhất tới những người cha – những người trụ cột kiên cường, luôn là điểm tựa an tâm và vững chãi nhất cho mỗi gia đình! #BaoVietNhantho #NgaycuaCha",Bảo Việt Nhân Thọ,165,45,2,https://www.facebook.com/www.BaoVietNhanTho.com.vn,https://www.facebook.com/www.BaoVietNhanTho.com.vn/posts/pfbid0kKqjnHpJyVf2Z91zdKnG5U8YMvwsFH2Qo3kQs6tQkvCk48xEneRGQbf514aDDNfil,https://scontent.fsgn5-13.fna.fbcdn.net/v/t39.99422-6/728175293_1934420997258257_1718091517513155509_n.png?stp=dst-jpg_tt6&cstp=mx2048x2048&ctp=s1080x2048&_nc_cat=106&ccb=1-7&_nc_sid=127cfc&_nc_ohc=xTFfmGryy3wQ7kNvwEvSJZr&_nc_oc=AdpuEQWnPbbto95eEdjBFa49KrrLfRItt7fkX2MnV9mKTxYsM8UAsSJQ0rZTRBfq3bLE3_dtJfpyDwuD2K6HIQOP&_nc_zt=14&_nc_ht=scontent.fsgn5-13.fna&_nc_gid=5vH5IJSYZ_XYWEc01qYwyQ&_nc_ss=7b2a8&oh=00_Af9KdNKynPtLA9-ThDb-h3Ocj8I6BJJpRNYZLTEIrhZFFw&oe=6A416AE5,
2026-06-19,"TRỌN VẠN DẶM AN: HƠN 8.000 MÃ QUAY THƯỞNG ĐÃ ĐƯỢC TRAO  ❤ Sự hưởng ứng từ khách hàng trên toàn quốc đang tạo nên những con số ấn tượng cho chương trình ""Trọn Vạn Dặm An"". Sau gần 3 tuần triển khai, hơn 8.000 mã quay thưởng đã được cấp và hơn 2.000 khách hàng đã đủ điều kiện nhận bộ quà tặng pickleball cao cấp.   🍀 Cơ hội nhận quà tặng và các giải thưởng giá trị vẫn đang chờ đón phía trước.  Hãy liên hệ Tư vấn viên Bảo Việt Nhân thọ hoặc văn phòng Bảo Việt Nhân thọ gần nhất để tìm hiểu và tham gia chương trình ngay hôm nay.  👉 Xem ngay chi tiết thể lệ chương trình: https://bit.ly/TronVanDamAn_fb Trọn Vạn Dặm An - Bắt đầu từ hôm nay! #BaoVietNhantho #TronVungvang #TronVanDamAn",Bảo Việt Nhân Thọ,103,32,1,https://www.facebook.com/www.BaoVietNhanTho.com.vn,https://www.facebook.com/www.BaoVietNhanTho.com.vn/posts/pfbid02MKBb4GJRwYcCAzEgwt8LYyaPhjcqA6svJXPygionrmZ1zWZsxSoD9M7p4uBSu2b4l,https://scontent.fsgn5-14.fna.fbcdn.net/v/t39.99422-6/727236167_952585611109552_110411388809869142_n.png?stp=dst-jpg_tt6&cstp=mx2000x2000&ctp=s1080x2048&_nc_cat=101&ccb=1-7&_nc_sid=127cfc&_nc_ohc=h_g1us9pXw8Q7kNvwH6C2HZ&_nc_oc=AdpnrqUnFqePQFBpYzce3c_Mc5-BC1DPkSazsGBGEAKmVtVngKAxZZvcu7N9RmpXempdzesvtD3bHQWOjYa6VYQZ&_nc_zt=14&_nc_ht=scontent.fsgn5-14.fna&_nc_gid=5vH5IJSYZ_XYWEc01qYwyQ&_nc_ss=7b2a8&oh=00_Af8Z82eQLq7mZvBPMGgDuM4Ka82IUK6tXk50aCRuPsI41Q&oe=6A4160F7,
2026-06-18,"CHÀO ĐÓN DẤU MỐC 30 NĂM - THÊM MỘT DẤU ẤN TỰ HÀO  Sáng ngày 18/06/2026, Bảo Việt Nhân thọ đón nhận tin vui ý nghĩa khi được Vietnam Report vinh danh dẫn đầu Danh sách Top 10 Công ty Bảo hiểm Nhân thọ uy tín Việt Nam năm 2026.  🍀 Đây là năm thứ 10 Bảo Việt Nhân thọ giữ vị trí dẫn đầu trong bảng xếp hạng – dấu ấn cho hành trình bền bỉ bảo vệ bình an cho hàng triệu gia đình Việt và khẳng định vị thế thương hiệu bảo hiểm Quốc gia trong lòng người dân Việt Nam.  ❤ Bảo Việt Nhân thọ trân trọng cảm ơn Quý Khách hàng, đối tác và cộng đồng đã luôn tin tưởng, đồng hành; cảm ơn các tổ chức uy tín đã ghi nhận những giá trị mà Bảo Việt Nhân thọ kiên định theo đuổi.  🍀Bước vào tuổi 30, Bảo Việt Nhân thọ tiếp tục đổi mới, chuyển đổi số nâng cao chất lượng sản phẩm, dịch vụ và trải nghiệm khách hàng, mang đến những giải pháp bảo vệ tài chính, chăm sóc sức khỏe tốt hơn cho người dân Việt.  Bảo Việt Nhân thọ - 30 năm - Trọn niềm tin thương hiệu Việt. #BaoVietNhantho #AnThinhPhucNien #TronVanDamAn",Bảo Việt Nhân Thọ,210,62,12,https://www.facebook.com/www.BaoVietNhanTho.com.vn,https://www.facebook.com/www.BaoVietNhanTho.com.vn/posts/pfbid02qnSWVqXtj9vHR7AC3aerX8giGwW9pwJk86R71m2KjnV5gKdYA2XT1LBYP3SeaYMbl,https://scontent.fsgn5-21.fna.fbcdn.net/v/t39.99422-6/726900715_1789547168676961_2660757637855119116_n.png?stp=dst-jpg_tt6&cstp=mx1875x1875&ctp=s1080x2048&_nc_cat=109&ccb=1-7&_nc_sid=127cfc&_nc_ohc=j_OsU8WdtcIQ7kNvwG5ssAT&_nc_oc=AdrM7_MrAhRa7pTW9EA-2Ia4cyjonC7lgJbBdKNDB4gRLHSO_tIqSweBjgMXY0N_qDeid06i6rPmUimdizPUMziv&_nc_zt=14&_nc_ht=scontent.fsgn5-21.fna&_nc_gid=O41nVQ3UpSp3pculRPx9eA&_nc_ss=7b2a8&oh=00_Af-7pzwm-gTxu2_Tdbn3r0t7JPiMBRFnrNjt9JLOhMRJrQ&oe=6A4180F1,
2026-06-18,"NHỮNG KẾ HOẠCH LỚN LUÔN BẮT ĐẦU TỪ HÔM NAY   Như hạt mầm được gieo vào đất, mỗi khoản tích lũy hôm nay với An Thịnh Phúc Niên sẽ lớn dần theo thời gian, mang đến bảo vệ, gia sản và một tuổi hưu an nhàn cho cả gia đình.  ✅ Gia tăng giá trị tài khoản với lãi suất cam kết tối thiểu. ✅ Thưởng duy trì hợp đồng lên đến 8% và thưởng hoàn phí rủi ro lên đến 100% theo quy định sản phẩm. ✅ Nhận 100% giá trị tài khoản khi đáo hạn, tạo nền tảng tài chính vững chắc cho những kế hoạch dài hạn. ✅ An tâm trước rủi ro không mong muốn với quyền lợi bảo vệ tài chính xuyên suốt thời gian tham gia.  Bởi một tương lai vững vàng luôn bắt đầu từ sự chuẩn bị hôm nay. An Thịnh Phúc Niên – Vun đắp đường dài, viên mãn mai sau. Chi tiết sản phẩm xem tại: https://bit.ly/AnThinhPhucNien_fb  #BaoVietNhantho #AnThinhPhucNien #TronVanDamAn",Bảo Việt Nhân Thọ,229,63,0,https://www.facebook.com/www.BaoVietNhanTho.com.vn,https://www.facebook.com/www.BaoVietNhanTho.com.vn/posts/pfbid0zgTaHRv4sHtZkC3VyfJhFVTEtnPzDaqYv5gy8UcyYkET4RV2K7GqgbB1zMcr88LLl,https://scontent.fsgn5-14.fna.fbcdn.net/v/t39.99422-6/724459251_1032416752818925_677231074171664350_n.png?stp=dst-jpg_tt6&cstp=mx2048x2048&ctp=s1080x2048&_nc_cat=101&ccb=1-7&_nc_sid=127cfc&_nc_ohc=d84_gdVouUAQ7kNvwE8c1XR&_nc_oc=AdrfijgXtjMRva1Awwz48CYnML0pYXXL4SfKS3QRwiCtua7NHSOA1_XP2xWOx1ZbOG4fr4_i8D-SRU7cx7cv_DWu&_nc_zt=14&_nc_ht=scontent.fsgn5-14.fna&_nc_gid=O41nVQ3UpSp3pculRPx9eA&_nc_ss=7b2a8&oh=00_Af_G_kx85Wo-PjsGOTm26CkiGCVE3QPgNirsDaM9dZw-Xg&oe=6A414E72,
2026-06-17,"An Thịnh Phúc Niên – Bạn thích mùa nào nhất?  Mỗi mùa trong An Thịnh Phúc Niên mang một thông điệp riêng, đồng hành cùng gia đình bạn trên hành trình tài chính dài lâu: 🌸 Xuân khởi – Ươm mầm an thịnh ☀️ Hạ vươn – Tỏa bóng bình yên 🍁 Thu an – Tích tài vun lộ ❄️ Đông ấm – Vẹn tròn phúc niên  💬 Bạn thích mùa nào nhất cho hành trình tài chính của gia đình mình? Bình luận mùa bạn chọn và cùng tìm hiểu quyền lợi của An Thịnh Phúc Niên nhé! Chi tiết sản phẩm xem tại: https://bit.ly/AnThinhPhucNien_fb  #BaoVietNhantho #AnThinhPhucNien #TronVanDamAn",Bảo Việt Nhân Thọ,156,43,2,https://www.facebook.com/www.BaoVietNhanTho.com.vn,https://www.facebook.com/www.BaoVietNhanTho.com.vn/posts/pfbid02nvfBxxCudAFBNzyveGHbwtUGwNh65uHYfzwF4WCcMgpkHn7LhmDT6CthzUCrzuRjl,,
2026-06-16,"📣 Đài Truyền hình HTV9 và nhiều cơ quan báo chí đưa tin về An Thịnh Phúc Niên – sản phẩm bảo hiểm liên kết chung mới của Bảo Việt Nhân thọ.  🌟 Với sự kết hợp giữa các quyền lợi bảo vệ, tích lũy và gia tăng giá trị tài khoản theo thời gian, An Thịnh Phúc Niên đồng hành cùng khách hàng trên hành trình vun đắp cuộc sống an thịnh hôm nay, hướng tới phúc niên mai sau.  Trong dấu mốc 30 năm đồng hành cùng người Việt, An Thịnh Phúc Niên tiếp tục khẳng định cam kết của Bảo Việt Nhân thọ trong việc đồng hành cùng khách hàng trên hành trình xây dựng nền tảng tài chính vững vàng cho bản thân và gia đình.  #BaoVietNhantho #TronVanDamAn #AnThinhPhucNien",Bảo Việt Nhân Thọ,303,294,17,https://www.facebook.com/www.BaoVietNhanTho.com.vn,https://www.facebook.com/reel/1332352158263210/,,https://www.facebook.com/reel/1332352158263210/
2026-06-16,"Bốn mùa Xuân – Hạ – Thu – Đông của đất trời nói với chúng ta điều gì? 🍀 Bảo Việt Nhân thọ giới thiệu sản phẩm liên kết chung An Thịnh Phúc Niên, người bạn đồng hành giúp mỗi gia đình vun đắp từng bước đường dài, để tương lai viên mãn mai sau.  Mỗi mùa, một thông điệp riêng, mở ra hành trình tài chính đầy cảm hứng và an tâm. 🎬 Nhấn xem ngay để khám phá ý nghĩa bốn mùa và trải nghiệm hành trình An Thịnh Phúc Niên!   An Thịnh Phúc Niên – Vun đắp đường dài, viên mãn mai sau! Chi tiết sản phẩm xem tại: https://bit.ly/AnThinhPhucNien_fb  #BaoVietNhantho #TronVanDamAn #AnThinhPhucNien",Bảo Việt Nhân Thọ,610,317,28,https://www.facebook.com/www.BaoVietNhanTho.com.vn,https://www.facebook.com/reel/2043227926284828/,,https://www.facebook.com/reel/2043227926284828/
2026-06-16,"AN THỊNH PHÚC NIÊN – HÀNH TRÌNH VUN ĐẮP TƯƠNG LAI  Bốn mùa luân chuyển để đất trời đơm hoa kết trái, cũng như đời người trải qua những năm tháng tích lũy để hướng đến cuộc sống đủ đầy. Và mỗi gia đình đều cần những quyết định đúng lúc để xây dựng nền tảng vững chắc cho chặng đường phía trước. Nhân kỷ niệm 30 năm thành lập, Bảo Việt Nhân thọ ra mắt An Thịnh Phúc Niên – giải pháp tài chính đồng hành cùng gia đình trên hành trình vun đắp tương lai.  👉 Tích lũy bền vững: Cơ chế gia tăng giá trị tài khoản hiệu quả, giúp xây dựng nền tảng tài chính vững vàng cho mọi dự định trong tương lai. 👉  Tri ân gắn kết: Các quyền lợi thưởng hấp dẫn dành riêng cho khách hàng đồng hành lâu dài cùng Bảo Việt Nhân thọ. 👉  Bảo vệ toàn diện: Lá chắn tài chính vững chắc trước những rủi ro bất ngờ trong cuộc sống, mang lại sự an tâm cho cả gia đình.  An Thịnh Phúc Niên – Vun đắp đường dài, viên mãn mai sau! Chi tiết sản phẩm xem tại: https://bit.ly/AnThinhPhucNien_fb  #BaoVietNhantho #TronVanDamAn #AnThinhPhucNien",Bảo Việt Nhân Thọ,384,120,18,https://www.facebook.com/www.BaoVietNhanTho.com.vn,https://www.facebook.com/www.BaoVietNhanTho.com.vn/posts/pfbid035ktWHqRQAALJkVY4ckwF12jwCzR1XKULT4qx4y1bMKsa39Zgx9xVKCB3zpm5pwral,https://scontent.fsgn5-2.fna.fbcdn.net/v/t39.99422-6/721995086_1388172916667427_451922600116956759_n.png?stp=dst-jpg_tt6&cstp=mx2048x2048&ctp=s1080x2048&_nc_cat=105&ccb=1-7&_nc_sid=127cfc&_nc_ohc=jtvwDfwucE4Q7kNvwHuESvD&_nc_oc=AdqdX7elwkXwxOjR21nOicUlItE2EOAZFgML9PFur7Sy3_JBHULtkwiO49gjleSf1bEifkI4rfPchz0Vn5C5b4Jl&_nc_zt=14&_nc_ht=scontent.fsgn5-2.fna&_nc_gid=GRlebNyTv_z1ulzX9EMtcQ&_nc_ss=7b2a8&oh=00_Af-sryWTKqs8bB8_wchLYkbdbaBwN8aI2p51d3W63NAKCA&oe=6A417C33,
2026-06-15,"Mở hộp phần quà Pickleball đang được săn đón nhất ""Trọn Vạn Dặm An"" 🍀 Không chỉ mang đến cơ hội sở hữu xe VinFast VF6, VF3 hay VinFast Evo Grand, chương trình còn dành tặng bộ quà Pickleball cao cấp cho khách hàng đủ điều kiện tham gia. Cùng khám phá món quà đang được nhiều khách hàng yêu thích nhé!  #BaoVietNhantho #TronVungvang #TronVanDamAn",Bảo Việt Nhân Thọ,156,72,9,https://www.facebook.com/www.BaoVietNhanTho.com.vn,https://www.facebook.com/reel/1977968846255272/,,https://www.facebook.com/reel/1977968846255272/
2026-06-15,"❤️ LAN TỎA YÊU THƯƠNG TỪ NHỮNG ĐIỀU GIẢN DỊ ❤️  Ngày 15/6/2026, những “chiến binh áo xanh” tại Bảo Việt Nhân thọ Đồng Tháp đã trao tặng 200 “Suất ăn yêu thương” tới bà con trên địa bàn, với mong muốn sẻ chia phần nào hơi ấm và niềm vui trong cuộc sống thường ngày.  💙 Mỗi suất ăn được trao đi không chỉ là sự hỗ trợ thiết thực, mà còn là tấm lòng thể hiện tinh thần tương thân tương ái mà Bảo Việt Nhân thọ dành cho cộng đồng.  #BaoVietNhantho",Bảo Việt Nhân Thọ,313,28,9,https://www.facebook.com/www.BaoVietNhanTho.com.vn,https://www.facebook.com/www.BaoVietNhanTho.com.vn/posts/pfbid0UgxgQa8udrZAK7yPJLLs1753rar4wXs2eDRnfP2EEqkzx5rVeTgRRbPadCuU2aaxl,,
