post_date,content,fanpage_name,reaction,share,comment,fanpage_url,post_url,post_id,image_urls,video_url
2026-06-17,"Thông qua quan hệ hợp tác với Igloo, Chubb Life Việt Nam một lần nữa khẳng định mục tiêu mở rộng phạm vi tiếp cận các giải pháp bảo hiểm đến nhiều cá nhân và gia đình hơn.  Theo đó, danh mục sản phẩm đa dạng của Chubb Life gồm bảo hiểm nhân thọ, bảo hiểm sức khỏe và bảo hiểm bệnh hiểm nghèo sẽ được tích hợp vào nền tảng Ignite thuộc Igloo – với hạ tầng được phát triển bởi trí tuệ nhân tạo (AI), góp phần thúc đẩy việc đưa bảo hiểm đến gần hơn với đại chúng.  Trong bối cảnh dư địa thị trường bảo hiểm nhân thọ khu vực Đông Nam Á nói chung, và Việt Nam nói riêng, là rất lớn – thỏa thuận hợp tác giữa Chubb Life và Igloo được xem là đòn bẩy góp phần giúp thu hẹp khoảng trống bảo vệ và mở ra cơ hội tiếp cận giải pháp bảo hiểm cho hàng triệu người dùng.  ✴️Tìm hiểu chi tiết tại: https://tuoitre.vn/igloo-hop-tac-voi-chubb-life-mo-rong-sang-mang-bao-hiem-nhan-tho-20260615144257254.htm  #Chubb #ChubbLifeVietnam #Igloo #IgniteByIgloo #BaohiemcoChubblo #Damsongdoitudo",Chubb Life Vietnam,3073,10,10,https://www.facebook.com/BaohiemChubbLifeVietnam,https://www.facebook.com/BaohiemChubbLifeVietnam/posts/pfbid0r5Uj7uozpgukEbGMSmJCXuGt3AhArYsKYjTuXkQaTkytpP3D5reci8k6LqSDvTpFl,1459931602840532,https://scontent.fsgn5-13.fna.fbcdn.net/v/t39.99422-6/724453823_1022844330305588_1286037332087383026_n.png?stp=dst-jpg_tt6&cstp=mx2048x2048&ctp=s1080x2048&_nc_cat=100&_nc_map=urlgen_bucketless&ccb=1-7&_nc_sid=127cfc&_nc_ohc=c6Xjkn3C5vIQ7kNvwEiTGqt&_nc_oc=AdpqiRcVWg-B5-eSwwQToCUW4pffMHklSsThcMd7Ok2QJh3plHHx4rJz3KEcz-IIH8sQ7fTZ7KsXmqvfO9rO8mle&_nc_zt=14&_nc_ht=scontent.fsgn5-13.fna&_nc_gid=ntexrWyXtDJXHMoPpz99Ew&_nc_ss=7b2a8&oh=00_Af8rC3kNRXfk3kaqX2U9rQjLnJLyWOGDx7ISCCJPG6iIzw&oe=6A43C514,
2026-06-16,"BẢO HIỂM 101 CHUBB SERIES | #003 - QUÊN ĐÓNG PHÍ THÌ HỢP ĐỒNG CÓ MẤT HIỆU LỰC KHÔNG?  👉 Hãy tham khảo nội dung tuần này để lưu ý những cột mốc quan trọng để hành trình bảo vệ được trọn vẹn bạn nhé!   Trong tập 3 của Bảo hiểm 101 Chubb Series, Chubb Life sẽ cùng bạn tìm hiểu cách hợp đồng bảo hiểm được duy trì khi chưa kịp đóng phí đúng hạn và những hình thức nhắc phí tiện lợi tại Chubb Life - giúp bạn an tâm hơn trên hành trình bảo vệ tương lai.   📹 Hiểu bảo hiểm để bảo vệ cuộc sống vững vàng hơn! Hãy tiếp tục theo dõi Bảo hiểm 101 Chubb Series để trang bị thêm nhiều kiến thức hữu ích cho cả gia đình!   Bảo hiểm có Chubb lo - Dám sống đời tự do.  #Chubb #ChubbLifeVietnam #BaohiemcoChubblo #Damsongdoitudo #Baohiem101ChubbSeries",Chubb Life Vietnam,136,34,14,https://www.facebook.com/BaohiemChubbLifeVietnam,https://www.facebook.com/reel/2116636262230798/,1459177712915921,https://scontent.fsgn5-22.fna.fbcdn.net/v/t15.5256-10/721144503_1542221077461148_3531046690677162173_n.jpg?stp=dst-jpg_tt6&cstp=mx1440x1440&ctp=s960x960&_nc_cat=104&_nc_map=urlgen_bucketless&ccb=1-7&_nc_sid=5fad0e&_nc_ohc=u3F3gW3LAZMQ7kNvwGkDSMD&_nc_oc=Adpn22eeU2rUK1r8Yt9IyYDNodSuPciyFU2I4i6IVQD0QLC3qc4PQdetty1ObZnYQxMgb8hAx9IRLCCh5_n_IBO-&_nc_zt=23&_nc_ht=scontent.fsgn5-22.fna&_nc_gid=5yV5daxmomRfbMTghk1F_A&_nc_ss=7b2a8&oh=00_Af9UTIrtf_XTA-_Zd-rUwNW_3zh85s-O9kk82dYRJVu7_Q&oe=6A43F061 | https://scontent.fsgn5-1.fna.fbcdn.net/v/t39.2093-6/722132382_2116645145563243_6590357577295480078_n.srt?_nc_cat=102&_nc_map=urlgen_bucketless&ccb=1-7&_nc_sid=c211c2&_nc_ohc=Kyy6TheXSMYQ7kNvwHV51ms&_nc_oc=AdrjBwzR0gkHIZHR-TnelWGj0DIbvT3BEwBfbkRglNSlz4oAw9BdZgejDTCOjIuIWh1M5ApHheXcgJaqY7QKbImB&_nc_zt=14&_nc_ht=scontent.fsgn5-1.fna&_nc_gid=5yV5daxmomRfbMTghk1F_A&_nc_ss=7b2a8&oh=00_Af8owPy-NF2ypQw9gZX_5BRweNBcwCa6-bNnJFVI3vlAsg&oe=6A43BD53 | https://scontent.fsgn5-12.fna.fbcdn.net/o1/v/t2/f2/m412/AQMN8E9C0TiyVfUliRq6ZHFdEfCpEzLnIbHoS4vc_geuO52E-miWBF5d1cHEkfv1AjRyFPNUi_R-YCuVzraSfztSlVBYK_PvlhDVhfDsqQ.mp4?_nc_cat=111&_nc_oc=Ado973LaaEv9Zv2xyB-RLp4hCF4it7zynPp4DOg58Aja_dQeXFYqKwkqI8qFJ_IOVM91BeX48Ee35CsiAwmAQDy4&_nc_sid=8bf8fe&_nc_ht=scontent.fsgn5-12.fna.fbcdn.net&_nc_ohc=g4COqNMdsZIQ7kNvwFymxe9&efg=eyJ2ZW5jb2RlX3RhZyI6Inhwdl9wcm9ncmVzc2l2ZS5GQUNFQk9PSy4uQzMuMzYwLnN2ZV9zZCIsInhwdl9hc3NldF9pZCI6MTAyNjU5ODg4NjU0MzExNywiYXNzZXRfYWdlX2RheXMiOjgsInZpX3VzZWNhc2VfaWQiOjEwMTIyLCJkdXJhdGlvbl9zIjoxMDgsInVybGdlbl9zb3VyY2UiOiJ3d3cifQ%3D%3D&ccb=17-1&_nc_gid=5yV5daxmomRfbMTghk1F_A&_nc_ss=7b2a8&_nc_map=urlgen_bucketless&_nc_zt=28&oh=00_Af-44fxaE-MiHg89o1gNFSCbDJoD_IkO6vPkTmzQt56_Gg&oe=6A43D0A3&bitrate=105901&tag=sve_sd | https://scontent.fsgn5-12.fna.fbcdn.net/o1/v/t2/f2/m366/AQNNFlB8EzJdV26lD6pqOjApgTD6F4lqluPksU1wJqyOx2Uac_95blFyHbxKCR4rx7RIZeVZb2poSniPZh6WHUlj9SKtHdFNn98oU1HLAawkPw.mp4?_nc_cat=108&_nc_oc=AdrvjxaCWaz1O_gC-Vq3F4oNSu-xBToXcw3eewGKPUDfMfIOdyZIe9GZj3kqhkkd4GtK6LmfS85jt8nBe-RctLa3&_nc_sid=5e9851&_nc_ht=scontent.fsgn5-12.fna.fbcdn.net&_nc_ohc=RWWUew1P7PUQ7kNvwFnbwzf&efg=eyJ2ZW5jb2RlX3RhZyI6Inhwdl9wcm9ncmVzc2l2ZS5GQUNFQk9PSy4uQzMuNzIwLmRhc2hfaDI2NC1iYXNpYy1nZW4yXzcyMHAiLCJ4cHZfYXNzZXRfaWQiOjEwMjY1OTg4ODY1NDMxMTcsImFzc2V0X2FnZV9kYXlzIjo4LCJ2aV91c2VjYXNlX2lkIjoxMDEyMiwiZHVyYXRpb25fcyI6MTA4LCJ1cmxnZW5fc291cmNlIjoid3d3In0%3D&ccb=17-1&vs=ccb5e7b383ae35ad&_nc_vs=HBksFQIYRWZiX2VwaGVtZXJhbC82MDRDMjQwQTI4NUYyQ0RCMEQ2REZERDlCMEIzOUFCNV9tdF8xX3ZpZGVvX2Rhc2hpbml0Lm1wNBUAAsgBEgAVAhhAZmJfcGVybWFuZW50L0MwNDQ4RTkyNUY4MzUwMTE1NzQwMTc0MkE1MjQ4Q0E4X2F1ZGlvX2Rhc2hpbml0Lm1wNBUCAsgBEgAoABgAGwKIB3VzZV9vaWwBMRJwcm9ncmVzc2l2ZV9yZWNpcGUBMRUAACaavKzf9evSAxUCKAJDMywXQFsYAAAAAAAYGWRhc2hfaDI2NC1iYXNpYy1nZW4yXzcyMHARAHUCZZSeAQA&_nc_gid=5yV5daxmomRfbMTghk1F_A&_nc_ss=7b2a8&_nc_map=urlgen_bucketless&_nc_zt=28&oh=00_Af8fA58wIu7kO8pr5cl-KU2isZ-vCKWtxPtz1d7q4egSiQ&oe=6A43D144&bitrate=225097&tag=dash_h264-basic-gen2_720p | https://scontent.fsgn5-22.fna.fbcdn.net/v/t15.5256-10/721144503_1542221077461148_3531046690677162173_n.jpg?stp=dst-jpg_tt6&cstp=mx1440x1440&ctp=s960x960&_nc_cat=104&_nc_map=urlgen_bucketless&ccb=1-7&_nc_sid=50ce42&_nc_ohc=u3F3gW3LAZMQ7kNvwGkDSMD&_nc_oc=Adpn22eeU2rUK1r8Yt9IyYDNodSuPciyFU2I4i6IVQD0QLC3qc4PQdetty1ObZnYQxMgb8hAx9IRLCCh5_n_IBO-&_nc_zt=23&_nc_ht=scontent.fsgn5-22.fna&_nc_gid=5yV5daxmomRfbMTghk1F_A&_nc_ss=7b2a8&oh=00_Af9UTIrtf_XTA-_Zd-rUwNW_3zh85s-O9kk82dYRJVu7_Q&oe=6A43F061 | https://scontent.fsgn5-8.fna.fbcdn.net/v/t15.5256-10/724533970_26638580709152977_5663643494093664230_n.jpg?stp=dst-jpg_tt6&cstp=mx1000x1000&ctp=s1000x1000&_nc_cat=109&_nc_map=urlgen_bucketless&ccb=1-7&_nc_sid=06012f&_nc_ohc=ZeusE4BpwrkQ7kNvwFN69Xo&_nc_oc=AdqksLR2ewhdUgy4rMlOcnZzFdJ3UduEYYpEcOZ6NxwxSG6HArBAmHougkzduOiRS9VsGMIw6lEH4KgGLuDBAKYH&_nc_zt=23&_nc_ht=scontent.fsgn5-8.fna&_nc_gid=5yV5daxmomRfbMTghk1F_A&_nc_ss=7b2a8&oh=00_Af_0xD2VjxD-z5wRNRUNo76Wvm13XAz78ra8fpTulZGy3Q&oe=6A43E91F | https://scontent.fsgn5-13.fna.fbcdn.net/v/t15.5256-10/724558567_1534341448086986_1919321541464915867_n.jpg?stp=dst-jpg_tt6&cstp=mx1000x1000&ctp=s1000x1000&_nc_cat=107&_nc_map=urlgen_bucketless&ccb=1-7&_nc_sid=06012f&_nc_ohc=vQH-AgJXa_YQ7kNvwF5Oz4q&_nc_oc=AdokdmGc7xZp4wgAGFSvSuGraqT38pKsQLzgAC7QRoRpO3mzt2Fbym69G4xuTp6dqO7-glVfKEYtpewhPVODXdta&_nc_zt=23&_nc_ht=scontent.fsgn5-13.fna&_nc_gid=5yV5daxmomRfbMTghk1F_A&_nc_ss=7b2a8&oh=00_Af8ZwMDv6GrLj68q3Pg-e87yyXE6_PTIsrX9gECojJIl_A&oe=6A43D1A0,https://www.facebook.com/reel/2116636262230798/
2026-06-16,"Chubb Life Việt Nam ký kết hợp tác cùng Igloo, mở rộng khả năng tiếp cận giải pháp bảo vệ đến khách hàng.  Ngày 16/06 vừa qua, tại TP.HCM, Chubb Life Việt Nam đã chính thức ký kết thỏa thuận hợp tác với Igloo, đánh dấu một bước tiến mới trong chiến lược mở rộng khả năng tiếp cận các giải pháp bảo vệ đến khách hàng - thông qua các nền tảng công nghệ và kênh phân phối số.  Bằng việc thiết lập quan hệ hợp tác với Igloo, các giải pháp bảo hiểm nhân thọ, sức khỏe và bệnh hiểm nghèo của Chubb Life Việt Nam sẽ được triển khai trên hệ sinh thái phân phối Ignite, góp phần mang đến trải nghiệm bảo hiểm thuận tiện, đơn giản và phù hợp với nhu cầu của khách hàng.  Trong khuôn khổ sự kiện, Ông Sang Lee - Chủ tịch Chubb Life khu vực Đông Nam Á và New Zealand, Tổng Giám đốc Chubb Life Việt Nam nhấn mạnh: “Chubb Life Việt Nam và Igloo đều chia sẻ một ưu tiên chung: đặt khách hàng làm trọng tâm. Chính sự đồng điệu này là nền tảng để hai bên cùng xây dựng những giải pháp bảo vệ thiết thực hơn, kiến tạo các giá trị bền vững cho khách hàng, đối tác và cộng đồng.”  Sự hợp tác này cho phép Chubb Life Việt Nam và Igloo đồng hành cùng khách hàng trong từng giai đoạn cuộc sống, hướng tới mục tiêu bảo vệ hàng triệu gia đình một cách trọn vẹn.   #Chubb #ChubbLifeVietnam #Igloo  #Ignite #BaohiemcoChubblo #Damsongdoitudo",Chubb Life Vietnam,2688,39,35,https://www.facebook.com/BaohiemChubbLifeVietnam,https://www.facebook.com/BaohiemChubbLifeVietnam/posts/pfbid0232KNoFj1H7Ci6M74mFR3pDKQW6dBL1vUZHsSM8pEAMoWZnBqKg5B4NFUWvYKAn2ql,1458957856271240,https://scontent.fsgn5-10.fna.fbcdn.net/v/t39.99422-6/724770752_1493312281937336_6129682215373738316_n.png?stp=dst-jpg_tt6&cstp=mx2000x2000&ctp=s1080x2048&_nc_cat=110&_nc_map=urlgen_bucketless&ccb=1-7&_nc_sid=833d8c&_nc_ohc=RS2jfo7vE_wQ7kNvwFX_hSc&_nc_oc=AdrkOOpnRhYTbgGx7wMxjKa6sT_jGSs61wzsNqgT3YtH2U90fFml0knFCK4lW0G8_qRkFKUKJTTtEYCr8nnMHA8L&_nc_zt=14&_nc_ht=scontent.fsgn5-10.fna&_nc_gid=5yV5daxmomRfbMTghk1F_A&_nc_ss=7b2a8&oh=00_Af9mCdFgqSWHAAB4FhANvqa3Gvr47G5MJWxV4kzrgoRdlQ&oe=6A43EDA2,
2026-06-15,"🏠 CHÀO MỪNG ĐẾN VỚI NGÔI NHÀ CHUNG CỦA TƯ VẤN TÀI CHÍNH TOÀN TÂM CHUBB LIFE ✨ Mọi hành trình chạm đến giấc mơ lớn đều cần một bệ phóng vững chãi và xứng tầm. Trang thông tin truyền thông “Chubb - Tư Vấn Tài Chính Toàn Tâm” chính là câu trả lời. 🤝 Đặt ba giá trị cốt lõi ""Toàn tâm - Chuẩn mực - Tin cậy"" làm kim chỉ nam, Chubb Life không chỉ mang đến giải pháp tư vấn tài chính, mà còn đồng hành cùng khách hàng để thực hiện sứ mệnh ""Toàn tâm bảo vệ - Mở lối thành công"" cho tương lai mọi gia đình.  Với các tuyến nội dung cốt lõi như sau: ✅Tin tức về thương hiệu: Cập nhật tin tức các cột mốc phát triển và định hướng chiến lược của Chubb Life Việt Nam. ✅Kiến thức sản phẩm: Cung cấp các bài viết phân tích chi tiết về sản phẩm giúp tối ưu hóa kế hoạch bảo vệ khách hàng. ✅Bảng vàng thành tích: Vinh danh các cá nhân xuất sắc theo định kỳ. ✅Câu chuyện truyền cảm hứng: Những bài viết chuyên sâu về giá trị nhân văn của bảo hiểm và bài học thành công từ người đi trước. ✅Sự kiện bùng nổ: Điểm tin những khoảnh khắc ấn tượng từ các chuỗi sự kiện lớn, các phong trào thi đua trên toàn quốc. ✅Đào tạo chuyên sâu: Cung cấp tư liệu, cẩm nang chăm sóc khách hàng để mở ra cơ hội phát triển sự nghiệp bền vững.  Hãy nhấn nút ""Theo dõi"" trang ngay hôm nay để kết nối, sẻ chia và sẵn sàng cho hành trình mới đầy bứt phá: https://www.facebook.com/TVTCChubbLifeVietnam  👉 Trở thành Tư vấn Tài chính Toàn Tâm cùng Chubb Life ngay hôm nay!  #ChubbLifeVietNam #TuVanTaiChinhToanTam #AgencyFanpage",Chubb Life Vietnam,41,9,2,https://www.facebook.com/BaohiemChubbLifeVietnam,https://www.facebook.com/BaohiemChubbLifeVietnam/posts/pfbid02pWcdA4yLzLQv1BPzNTUr824aCsuTptHSHmx3rtNZiuyJ2Sqi3JvFfDQNrdhtnq5Ml,1457846673049025,https://scontent.fsgn5-13.fna.fbcdn.net/v/t39.99422-6/724894423_1896729074377317_1529088243488474710_n.png?stp=dst-jpg_tt6&cstp=mx2048x2048&ctp=s1080x2048&_nc_cat=111&_nc_map=urlgen_bucketless&ccb=1-7&_nc_sid=127cfc&_nc_ohc=wcQnF-NgnPMQ7kNvwEyjdDA&_nc_oc=Adp5SjyKJUcrZFU0dqOHzShAUB-Idmd-bILyqx9yuICMhzUg4QLGD1u85CBhBr2BY8lUPSPXoBWelVDdCYO8_eQN&_nc_zt=14&_nc_ht=scontent.fsgn5-13.fna&_nc_gid=5yV5daxmomRfbMTghk1F_A&_nc_ss=7b2a8&oh=00_Af8Us22y7rBygq_Y2hiQ_-wcN04cGoe_AcgReAEro9exnw&oe=6A43CD80,
2026-06-14,"💎Ai cũng có ít nhất một lý do để cố gắng mỗi ngày. Và một giá trị để gìn giữ cho tương lai:  SỨC KHOẺ - BÌNH AN - HẠNH PHÚC - THỊNH VƯỢNG - DI SẢN 👉Bạn đã hiểu và hành động đúng cách để bảo vệ những giá trị sống ấy?   💫Tháng 6 này, Chubb Life trân trọng giới thiệu hành trình “Hiểu Bảo Vệ” - để bạn và những người thân yêu Dám sống đời tự do!   💥Cùng nhiều điều thú vị đang chờ bạn khám phá:  💡Khai mở không gian kiến thức bảo hiểm cùng chuyên gia 💡Bỏ túi loạt kỹ năng bảo vệ cho cả gia đình 💡Giải mã những quyết định tài chính quan trọng ở từng cột mốc cuộc sống 💡Khám phá những câu chuyện bảo vệ qua lăng kính tương tác đầy hứng khởi  COMING SOON! 06.2026  Bảo hiểm có Chubb lo - Dám sống đời tự do  #Chubb #ChubbLifeVietnam  #BaohiemcoChubblo #HieuBaoVe #Damsongdoitudo",Chubb Life Vietnam,10168,23,617,https://www.facebook.com/BaohiemChubbLifeVietnam,https://www.facebook.com/reel/2450480885453844/,1457327829767576,https://scontent.fsgn5-10.fna.fbcdn.net/v/t15.5256-10/723406450_1002700915572898_7735229927665931539_n.jpg?stp=dst-jpg_tt6&cstp=mx1080x1920&ctp=p960x960&_nc_cat=104&_nc_map=urlgen_bucketless&ccb=1-7&_nc_sid=5fad0e&_nc_ohc=sdkHjjdkltgQ7kNvwFzqx_K&_nc_oc=Adr3IMbzTT2dvf5iJvCdzFl-Wi2PgTtkoMDWhmLQI37Mb2rNQnM5bdMrRP1AeZMw7-ScvEncLwMY8hLyBQ79JBj4&_nc_zt=23&_nc_ht=scontent.fsgn5-10.fna&_nc_gid=gS2-H9L9qZfXtvsQhPo9_A&_nc_ss=7b2a8&oh=00_Af_cXPlKQ9si0ZxDmLNAJiZmOipKdirF4pmG08usNgA54g&oe=6A43DF41 | https://scontent.fsgn5-22.fna.fbcdn.net/v/t39.2093-6/724568854_2341468656378482_3299003840637131892_n.srt?_nc_cat=109&_nc_map=urlgen_bucketless&ccb=1-7&_nc_sid=c211c2&_nc_ohc=5uvu2QNrTaQQ7kNvwFxEYMr&_nc_oc=AdrEDVk4frnSNV-IZrqwV5j_FGM2vOxZrT1ijqcf0h5r5Z4o0P0vhSoAGHp2B_HPFRWN3ZR_uHpIno6PrsQD4aXa&_nc_zt=14&_nc_ht=scontent.fsgn5-22.fna&_nc_gid=gS2-H9L9qZfXtvsQhPo9_A&_nc_ss=7b2a8&oh=00_Af-PO561uRZJ1S5AZVCC-kSamCcTs7Kgz7tbG3RaSLaDXQ&oe=6A43C7CE | https://scontent.fsgn5-1.fna.fbcdn.net/v/t39.2093-6/724419828_2341468653045149_8380123308029432173_n.srt?_nc_cat=100&_nc_map=urlgen_bucketless&ccb=1-7&_nc_sid=c211c2&_nc_ohc=U4jdT4knR1cQ7kNvwHhPZX4&_nc_oc=AdqoMfeVsGfoe0ee-uUAa2xGctvCo9siIBQ8DdKqy41Y_c5uvPrCmwPv8BcFysrjE8JM7lprx3Bt6rPjCnOCHQ3-&_nc_zt=14&_nc_ht=scontent.fsgn5-1.fna&_nc_gid=gS2-H9L9qZfXtvsQhPo9_A&_nc_ss=7b2a8&oh=00_Af8DW7uhlso6KTvWXPqv2apEhLLGOAR1SajKpvj0iYhEOQ&oe=6A43D6FC | https://scontent.fsgn5-6.fna.fbcdn.net/v/t39.2093-6/718140393_2341468639711817_348864608665759568_n.srt?_nc_cat=102&_nc_map=urlgen_bucketless&ccb=1-7&_nc_sid=c211c2&_nc_ohc=WhE820FNsdEQ7kNvwEHMZoM&_nc_oc=AdoZKRH4rda3N04FzZMzf2laEBeq9ghrYEZyEjLoZGofcoNTbz-JwYiymu_Of6x3q1rgRkzuOR0Ur_zijhgrbCUa&_nc_zt=14&_nc_ht=scontent.fsgn5-6.fna&_nc_gid=gS2-H9L9qZfXtvsQhPo9_A&_nc_ss=7b2a8&oh=00_Af9OJAGzfgtnNJi11heuDqLHdqEn3vGPHADhXRNFFO5eww&oe=6A43BC1E | https://scontent.fsgn5-8.fna.fbcdn.net/v/t39.2093-6/723686428_2341468649711816_5244672479182974724_n.srt?_nc_cat=105&_nc_map=urlgen_bucketless&ccb=1-7&_nc_sid=c211c2&_nc_ohc=MiV8i7YDjeEQ7kNvwFV-4cy&_nc_oc=Adq8CPUbRIrmg3AJcKI9XvYhHLqO6Ze2e5J9JKlIZeTyzOZefjN27aqn163Ryxu3PVPmESoLRWpq8n95kSXZ0nc_&_nc_zt=14&_nc_ht=scontent.fsgn5-8.fna&_nc_gid=gS2-H9L9qZfXtvsQhPo9_A&_nc_ss=7b2a8&oh=00_Af-JRcTpnHAcdgHQJMqvpGo4DizysGQg1dEu2ekDghkiNA&oe=6A43BF94 | https://scontent.fsgn5-10.fna.fbcdn.net/v/t39.2093-6/724134066_2341468646378483_4261419916428568434_n.srt?_nc_cat=111&_nc_map=urlgen_bucketless&ccb=1-7&_nc_sid=c211c2&_nc_ohc=0M_31HhXRZUQ7kNvwF1sCjG&_nc_oc=AdoBXV69lib4ctbsoXD0CrnjOY7rXLK4qlPqBAyxtHLu-qmMU4ci0288KHnIkZwNj9iDfcLJCai1Ze7xTJT3ZV7e&_nc_zt=14&_nc_ht=scontent.fsgn5-10.fna&_nc_gid=gS2-H9L9qZfXtvsQhPo9_A&_nc_ss=7b2a8&oh=00_Af_JZRrEU2GDR00aOBCbjRon76dZ_FNYoxOcrC7d492Hvg&oe=6A43F00F | https://scontent.fsgn5-6.fna.fbcdn.net/v/t39.2093-6/722859000_2341468663045148_2035522954364894728_n.srt?_nc_cat=110&_nc_map=urlgen_bucketless&ccb=1-7&_nc_sid=c211c2&_nc_ohc=Z5CFErSJNYAQ7kNvwHjw5qM&_nc_oc=AdpzbyhnmfPpIv8aDaDblnelbZg7CPfFqU8-XfNZPYWXqYGl3OAavsy_kZ5VY2Ygn7AtxOY_hWkvSA7OAes8S4n_&_nc_zt=14&_nc_ht=scontent.fsgn5-6.fna&_nc_gid=gS2-H9L9qZfXtvsQhPo9_A&_nc_ss=7b2a8&oh=00_Af9dn7JOdn0KreFG54_DirvGCZgrpFcxjJEOXYLLpAS73Q&oe=6A43C50D | https://scontent.fsgn5-5.fna.fbcdn.net/v/t39.2093-6/723613099_2341468636378484_3699930036595836753_n.srt?_nc_cat=100&_nc_map=urlgen_bucketless&ccb=1-7&_nc_sid=c211c2&_nc_ohc=vS447Jd4o9QQ7kNvwGYxQKp&_nc_oc=AdrYu2BHg1SyTuq20WXdaGhl0AejHb1WxVHyh-2cEnAk_SJSVvMEN_UzGkUKvKeTGc4A0qScdOh1X_zGAax2XJp9&_nc_zt=14&_nc_ht=scontent.fsgn5-5.fna&_nc_gid=gS2-H9L9qZfXtvsQhPo9_A&_nc_ss=7b2a8&oh=00_Af-Em5fouHnrFGIZ3P0jg_NjOzGPUZ7nT-L7wBtwz2IT9w&oe=6A43D0E8 | https://scontent.fsgn5-6.fna.fbcdn.net/v/t39.2093-6/723144579_2341468643045150_7064062866454499800_n.srt?_nc_cat=109&_nc_map=urlgen_bucketless&ccb=1-7&_nc_sid=c211c2&_nc_ohc=kXNSXWqf2nIQ7kNvwFSpBCE&_nc_oc=Adri4I7wOs1udhHcaHmHTVLL-2HLhyxPWwGMXKHxESfb0AGCeYtwTLg1ktI4IbNr6O5tpVJ3sWmu38avpFHAdp1l&_nc_zt=14&_nc_ht=scontent.fsgn5-6.fna&_nc_gid=gS2-H9L9qZfXtvsQhPo9_A&_nc_ss=7b2a8&oh=00_Af9lEFOKJNHru-wmLaqN2Qqgz1QBKYnEjIAP3hvp3aQMhA&oe=6A43C236 | https://scontent.fsgn5-9.fna.fbcdn.net/v/t39.2093-6/721348890_2341468659711815_4281137612543088400_n.srt?_nc_cat=102&_nc_map=urlgen_bucketless&ccb=1-7&_nc_sid=c211c2&_nc_ohc=XLKCAtZL_6UQ7kNvwGObML_&_nc_oc=AdpQpH-zR6fqi6QY4poV4lJwzCwUD92wgIFnoOk28dvU1l4epEda8YIOC9bFvP44btISSTtz2dkK9v-HqP5KLTQF&_nc_zt=14&_nc_ht=scontent.fsgn5-9.fna&_nc_gid=gS2-H9L9qZfXtvsQhPo9_A&_nc_ss=7b2a8&oh=00_Af96usFdlPh74rrC5IIBW2kjusYEBcfvaBoYvMM6-OgKWQ&oe=6A43C207 | https://scontent.fsgn5-1.fna.fbcdn.net/o1/v/t2/f2/m412/AQMH3_ugbIEYnjlYvrtAqGEy7JlOPHHJZbk16rCUnAuMfqBviJo5KYKZGt9dlFkE8y_tRXdCJTONgY2mHOnIBXaS9TlMgferhZKRdMUCcQ.mp4?_nc_cat=110&_nc_oc=Ado5DMrujh407VHfCg6scMpFjkllOQBfSkN_xpFDmo4a-v4lO6SHb0JR-QPtlQvHdVs_iJzSwEDipkZZZLKzWyoL&_nc_sid=8bf8fe&_nc_ht=scontent.fsgn5-1.fna.fbcdn.net&_nc_ohc=EBFKwm9_aKkQ7kNvwGiVfNI&efg=eyJ2ZW5jb2RlX3RhZyI6Inhwdl9wcm9ncmVzc2l2ZS5GQUNFQk9PSy4uQzMuMzYwLnN2ZV9zZCIsInhwdl9hc3NldF9pZCI6MTc5MjYzOTY5ODc4MjQ1MywiYXNzZXRfYWdlX2RheXMiOjExLCJ2aV91c2VjYXNlX2lkIjoxMDEyMiwiZHVyYXRpb25fcyI6MjcsInVybGdlbl9zb3VyY2UiOiJ3d3cifQ%3D%3D&ccb=17-1&_nc_gid=gS2-H9L9qZfXtvsQhPo9_A&_nc_ss=7b2a8&_nc_map=urlgen_bucketless&_nc_zt=28&oh=00_Af87rqqzFZP7XQ_IC3QsN8CaYafqZHRV1R0pxmUakM8QcQ&oe=6A43EAB0&bitrate=153246&tag=sve_sd | https://scontent.fsgn5-7.fna.fbcdn.net/o1/v/t2/f2/m366/AQN5sGA_PgErieabQYRBxl0lyDsZTUcMvE3n18zXU_ZHPDQUYLf9P-ELVETvgSwIhklTe7JBRXlMdpareC8ZXYtVYyZC5HhomEurj1xUhPy2DA.mp4?_nc_cat=100&_nc_oc=Adokf5iNy2CwUqRjeMx50VySAZ99NeVjLfeJiZpjhMnmyG-Bld5GUIDpBkyaufxAGK__hjciSTAfB18K_mG1Y4OR&_nc_sid=5e9851&_nc_ht=scontent.fsgn5-7.fna.fbcdn.net&_nc_ohc=gM4UTywjjjkQ7kNvwGBE-uo&efg=eyJ2ZW5jb2RlX3RhZyI6Inhwdl9wcm9ncmVzc2l2ZS5GQUNFQk9PSy4uQzMuNzIwLmRhc2hfaDI2NC1iYXNpYy1nZW4yXzcyMHAiLCJ4cHZfYXNzZXRfaWQiOjE3OTI2Mzk2OTg3ODI0NTMsImFzc2V0X2FnZV9kYXlzIjoxMSwidmlfdXNlY2FzZV9pZCI6MTAxMjIsImR1cmF0aW9uX3MiOjI3LCJ1cmxnZW5fc291cmNlIjoid3d3In0%3D&ccb=17-1&vs=1789cf00c2c61d33&_nc_vs=HBksFQIYRWZiX2VwaGVtZXJhbC85QjRGOEY5RjIwODJEOTVBREQ5RTRBNzRBRkUzMDNBM19tdF8xX3ZpZGVvX2Rhc2hpbml0Lm1wNBUAAsgBEgAVAhhAZmJfcGVybWFuZW50LzEwNDhFMUM1M0ExRjBGOUQ5RjY5REE5RUIzM0M5Mzg1X2F1ZGlvX2Rhc2hpbml0Lm1wNBUCAsgBEgAoABgAGwKIB3VzZV9vaWwBMRJwcm9ncmVzc2l2ZV9yZWNpcGUBMRUAACbqo6bHrpmvBhUCKAJDMywXQDt-dsi0OVgYGWRhc2hfaDI2NC1iYXNpYy1nZW4yXzcyMHARAHUCZZSeAQA&_nc_gid=gS2-H9L9qZfXtvsQhPo9_A&_nc_ss=7b2a8&_nc_map=urlgen_bucketless&_nc_zt=28&oh=00_Af8QfSA-CNaPUVbx1nYpoF7zyNiXByR7th9nIQKJLBHd_A&oe=6A43BD4C&bitrate=401163&tag=dash_h264-basic-gen2_720p | https://scontent.fsgn5-10.fna.fbcdn.net/v/t15.5256-10/723406450_1002700915572898_7735229927665931539_n.jpg?stp=dst-jpg_tt6&cstp=mx1080x1920&ctp=s960x960&_nc_cat=104&_nc_map=urlgen_bucketless&ccb=1-7&_nc_sid=50ce42&_nc_ohc=sdkHjjdkltgQ7kNvwFzqx_K&_nc_oc=Adr3IMbzTT2dvf5iJvCdzFl-Wi2PgTtkoMDWhmLQI37Mb2rNQnM5bdMrRP1AeZMw7-ScvEncLwMY8hLyBQ79JBj4&_nc_zt=23&_nc_ht=scontent.fsgn5-10.fna&_nc_gid=gS2-H9L9qZfXtvsQhPo9_A&_nc_ss=7b2a8&oh=00_Af_cXPlKQ9si0ZxDmLNAJiZmOipKdirF4pmG08usNgA54g&oe=6A43DF41 | https://scontent.fsgn5-1.fna.fbcdn.net/v/t15.5256-10/722934016_2795713694096250_1776652570266366158_n.jpg?stp=dst-jpg_tt6&cstp=mx1000x1760&ctp=s1000x1760&_nc_cat=111&_nc_map=urlgen_bucketless&ccb=1-7&_nc_sid=06012f&_nc_ohc=ZK8UpcFElyAQ7kNvwGdMND1&_nc_oc=Ado2DFEelkqWx3pDIsMw8i9hAbWI8eWGl_OPEQ-EXrjWdXLNnh2HO9f5vWC0t1bwfTrrLvtTWwhTdXT4xU_DRLr4&_nc_zt=23&_nc_ht=scontent.fsgn5-1.fna&_nc_gid=gS2-H9L9qZfXtvsQhPo9_A&_nc_ss=7b2a8&oh=00_Af-2QrzarHVhpfprrNOs4Ws_9RuSwS3IiZfzqIsYCDwpnQ&oe=6A43CBFC,https://www.facebook.com/reel/2450480885453844/
2026-06-12,"21 năm Chubb Life Việt Nam: Bảo vệ để hưu trí an nhàn  Tuổi hưu không phải một khoảng lặng. Đó là khởi đầu của một hành trình khác - chậm rãi hơn, sâu sắc hơn và tự do chiêm nghiệm cuộc sống.  🌿 Trở lại những đam mê từng dang dở 🌿 Kết nối với những người bạn cũ 🌿 Mở ra cuộc sống mới - trồng thêm một loại hoa, thử những chuyến đi xa, hay đơn giản là tận hưởng sự thong dong, quần quây bên con cháu.   Để hành trình hưu trí được trọn vẹn, một nền tảng tài chính vững vàng cùng sự bảo vệ toàn diện về sức khỏe là điều không thể thiếu. 🛡️Chubb Life Việt Nam sẽ luôn ở cạnh bên, để BẠN an tâm tận hưởng những năm tháng hưu trí theo cách của riêng mình.  Bảo hiểm có Chubb lo - Dám sống đời tự do!  #Chubb #ChubbLifeVietnam #BaohiemcoChubblo #Damsongdoitudo #21NamGanKetVuonXa",Chubb Life Vietnam,130,19,237,https://www.facebook.com/BaohiemChubbLifeVietnam,https://www.facebook.com/reel/1031945035965695/,1455548386612187,https://scontent.fsgn5-15.fna.fbcdn.net/v/t15.5256-10/721466144_2415543892308174_5462394298910395670_n.jpg?stp=dst-jpg_tt6&cstp=mx1440x1440&ctp=s960x960&_nc_cat=101&_nc_map=urlgen_bucketless&ccb=1-7&_nc_sid=5fad0e&_nc_ohc=-FBUHS_wr-sQ7kNvwEI0G_p&_nc_oc=AdoV0Cew-1B7vfbtFhfY3gXN1uX5w_jXjNWmqfC4DRY2Fybn4Ul067s7iYnU3mZP9TA4-Y8RkiuUJs-eqx92jRqo&_nc_zt=23&_nc_ht=scontent.fsgn5-15.fna&_nc_gid=gS2-H9L9qZfXtvsQhPo9_A&_nc_ss=7b2a8&oh=00_Af_SIAiTOmARvMZHNsR8RGoKchXic3C2Q_nDKDQC_5TR1Q&oe=6A43C098 | https://scontent.fsgn5-3.fna.fbcdn.net/o1/v/t2/f2/m412/AQM6cNDqoq-VHZJPMo-sTJwYx_JAVsiheVpRl8tc-d5y4KYtsuTdw7GKUWymN5iqmVdw7JDqbocbiJcwKEx3MM8FaCQz_heXaQ3Wi-h7lQ.mp4?_nc_cat=111&_nc_oc=AdqTK7-S1SQzaxIWAshX5u06Tc-YyfGtTuQekpYQ3bpXMRI4o2Uc-yWLJI8Mp-xgOQ4rMdU5f5URS1bg9xz89QEo&_nc_sid=8bf8fe&_nc_ht=scontent.fsgn5-3.fna.fbcdn.net&_nc_ohc=CY5xfR_SWYQQ7kNvwGp7Dyz&efg=eyJ2ZW5jb2RlX3RhZyI6Inhwdl9wcm9ncmVzc2l2ZS5GQUNFQk9PSy4uQzMuMzYwLnN2ZV9zZCIsInhwdl9hc3NldF9pZCI6MTcwNzM1NzIyMDQ0MzE4MywiYXNzZXRfYWdlX2RheXMiOjEzLCJ2aV91c2VjYXNlX2lkIjoxMDEyMiwiZHVyYXRpb25fcyI6MTIsInVybGdlbl9zb3VyY2UiOiJ3d3cifQ%3D%3D&ccb=17-1&_nc_gid=gS2-H9L9qZfXtvsQhPo9_A&_nc_ss=7b2a8&_nc_map=urlgen_bucketless&_nc_zt=28&oh=00_Af_TMbgnW0piutMGMrtY_5lB_oCakDjJFxk9LTacP0A7dQ&oe=6A43C83B&bitrate=147029&tag=sve_sd | https://scontent.fsgn5-10.fna.fbcdn.net/o1/v/t2/f2/m366/AQMFJQjRW0hyRHzgzIyEH6gW7RCwSNKu8v3gZPq1N1NOuYr4xo3gbAzjj6t_s-6Tn3T_9RGKDFKaVhUiAMOVaA42hWt6-Ye2ecp1VuVm6s0JDQ.mp4?_nc_cat=103&_nc_oc=AdreCd7Vp8nMovQBhR9gfU6UbHcEOcfDTMybj7LcDqprVGxO2ayx5FR-fZaVsahdNOWYi4oJRD_DremJxuvpKBax&_nc_sid=5e9851&_nc_ht=scontent.fsgn5-10.fna.fbcdn.net&_nc_ohc=x8OZ2JbPq8cQ7kNvwFfO4ua&efg=eyJ2ZW5jb2RlX3RhZyI6Inhwdl9wcm9ncmVzc2l2ZS5GQUNFQk9PSy4uQzMuNzIwLmRhc2hfaDI2NC1iYXNpYy1nZW4yXzcyMHAiLCJ4cHZfYXNzZXRfaWQiOjE3MDczNTcyMjA0NDMxODMsImFzc2V0X2FnZV9kYXlzIjoxMywidmlfdXNlY2FzZV9pZCI6MTAxMjIsImR1cmF0aW9uX3MiOjEyLCJ1cmxnZW5fc291cmNlIjoid3d3In0%3D&ccb=17-1&vs=4354543baa341e35&_nc_vs=HBksFQIYRWZiX2VwaGVtZXJhbC80ODQzNDFEOEZEMjQ1NkNBQTNEQ0RBQzFDMjc3MUE4Rl9tdF8xX3ZpZGVvX2Rhc2hpbml0Lm1wNBUAAsgBEgAVAhhAZmJfcGVybWFuZW50L0Y5NDUwMTIzQTk5QzA4RjE0OEFBMjg2NjZCRUYzOEFEX2F1ZGlvX2Rhc2hpbml0Lm1wNBUCAsgBEgAoABgAGwKIB3VzZV9vaWwBMRJwcm9ncmVzc2l2ZV9yZWNpcGUBMRUAACbe0IjKorWIBhUCKAJDMywXQCgAAAAAAAAYGWRhc2hfaDI2NC1iYXNpYy1nZW4yXzcyMHARAHUCZZSeAQA&_nc_gid=gS2-H9L9qZfXtvsQhPo9_A&_nc_ss=7b2a8&_nc_map=urlgen_bucketless&_nc_zt=28&oh=00_Af8EtX3a21QY871gYiSU1gtth-qyo3P6ajJGVZbVLJZw_g&oe=6A43D2B1&bitrate=368693&tag=dash_h264-basic-gen2_720p | https://scontent.fsgn5-15.fna.fbcdn.net/v/t15.5256-10/721466144_2415543892308174_5462394298910395670_n.jpg?stp=dst-jpg_tt6&cstp=mx1440x1440&ctp=s960x960&_nc_cat=101&_nc_map=urlgen_bucketless&ccb=1-7&_nc_sid=50ce42&_nc_ohc=-FBUHS_wr-sQ7kNvwEI0G_p&_nc_oc=AdoV0Cew-1B7vfbtFhfY3gXN1uX5w_jXjNWmqfC4DRY2Fybn4Ul067s7iYnU3mZP9TA4-Y8RkiuUJs-eqx92jRqo&_nc_zt=23&_nc_ht=scontent.fsgn5-15.fna&_nc_gid=gS2-H9L9qZfXtvsQhPo9_A&_nc_ss=7b2a8&oh=00_Af_SIAiTOmARvMZHNsR8RGoKchXic3C2Q_nDKDQC_5TR1Q&oe=6A43C098 | https://scontent.fsgn5-9.fna.fbcdn.net/v/t15.5256-10/723599684_1704629850856744_1498056327548022673_n.jpg?stp=dst-jpg_tt6&cstp=mx1000x1000&ctp=s1000x1000&_nc_cat=102&_nc_map=urlgen_bucketless&ccb=1-7&_nc_sid=06012f&_nc_ohc=qlrNeHQAqcgQ7kNvwFRG5pl&_nc_oc=AdrTfWttg1tzlrgzc0B8ARNxRSupGrvo9K9Dod0TwPhyjVvwYSHe7G1-oEDcaDh4vzKOM6vq9oSjENv0FnmSzlwE&_nc_zt=23&_nc_ht=scontent.fsgn5-9.fna&_nc_gid=gS2-H9L9qZfXtvsQhPo9_A&_nc_ss=7b2a8&oh=00_Af_wkzpCLO2FMfMiDm2-VtLa74g3GMBveuST2gy5ewAk6g&oe=6A43ECF3,https://www.facebook.com/reel/1031945035965695/
