post_date,content,fanpage_name,reaction,share,comment,fanpage_url,post_url,post_id,image_urls,video_url
2026-06-11,"📖 SĨ TỬ VƯỢT VŨ MÔN - CHUBB ĐỒNG HÀNH TỰ DO HỌC TẬP  Kỳ thi này, các sĩ tử chỉ cần tập trung vào một điều: bước vào phòng thi với tất cả những gì đã chuẩn bị suốt 12 năm qua.  Còn với BẠN - người luôn dõi theo từng bước trưởng thành của con - điều mong mỏi lớn nhất có lẽ không chỉ là một kết quả tốt, mà là con luôn có cơ hội tiếp tục mở rộng tri thức, khám phá thế giới và theo đuổi những hoài bão của riêng mình.  Bởi việc học không chỉ gói gọn trong những năm tháng trên ghế nhà trường hay cánh cửa đại học. Đó là hành trình không ngừng tích lũy trải nghiệm, phát triển bản thân để tự tin tiến về phía trước.  🛡 Chubb Life luôn ở đây, đồng hành cùng BẠN chuẩn bị hành trang vững vàng, để con tự do học tập và tiến bước tương lai.  👉 Tìm hiểu giải pháp Chubb - Tự Do An Phúc để chủ động xây dựng nền tảng vững vàng cho con: www.chubb.com/vn-vn/personal/essential-plan-universal-life.html  Bảo hiểm có Chubb lo - Dám sống đời tự do  #Chubb #ChubbLifeVietnam #BaoHiemCoChubbLo #DamSongDoiTuDo",Chubb Life Vietnam,3118,23,160,https://www.facebook.com/BaohiemChubbLifeVietnam,https://www.facebook.com/BaohiemChubbLifeVietnam/posts/pfbid0qUkUphSmSdAY7Qvp4BDP947Mkwd55Yj6ZZcXanW7nJ3aLPhnWNm3f1sTWGevz9Evl,1454614980038861,https://scontent.fsgn5-5.fna.fbcdn.net/v/t39.99422-6/722039035_2022641971945585_1361795270543488023_n.png?stp=dst-jpg_tt6&cstp=mx1440x1440&ctp=s1080x2048&_nc_cat=110&_nc_map=urlgen_bucketless&ccb=1-7&_nc_sid=833d8c&_nc_ohc=KJoHqb9YBQcQ7kNvwHtDcM1&_nc_oc=AdpRV2A5FbZRB9yejIMRKkJPhDKFi5p-dN0zT9bB0DjSmICGH4adDj9PcwzAEa49q6uU9ZjKw2fy-qaPqmCFC2E0&_nc_zt=14&_nc_ht=scontent.fsgn5-5.fna&_nc_gid=gS2-H9L9qZfXtvsQhPo9_A&_nc_ss=7b2a8&oh=00_Af8oN9hxnF5tOfFwuxeaheUbSwoofW2nCj6db6k-XX5fsg&oe=6A43BC1A,
2026-06-10,"21 năm Chubb Life Việt Nam: bảo vệ để mọi hành trình đều có nhau  Cuộc sống trọn vẹn là khi ta có người cùng sẻ chia những hành trình đáng nhớ. 🚲Là cùng nhau đặt chân đến vùng đất trong mơ ✈️Cùng quyết tâm chinh phục những đỉnh cao mới 🌅Và cùng vững vàng trước những chương sống kế tiếp  Giá trị của bảo hiểm không phải để cuộc sống bớt đi những hành trình, mà để mỗi hành trình ta đã chọn - được đủ đầy, trọn vẹn, có nhau.   21 năm đồng hành cùng người Việt, chúng tôi luôn khát khao trở thành điểm tựa để bạn sống tự do trong từng khoảnh khắc, và tự tin viết tiếp hành trình của riêng mình - cùng người mà bạn yêu thương. 💕  Bảo hiểm có Chubb lo - Dám sống đời tự do  #Chubb #ChubbLifeVietnam #BaohiemcoChubblo #Damsongdoitudo",Chubb Life Vietnam,150,23,258,https://www.facebook.com/BaohiemChubbLifeVietnam,https://www.facebook.com/reel/1592002759005114/,1453274333506259,https://scontent.fsgn5-21.fna.fbcdn.net/v/t15.5256-10/718111528_1032299752566661_2896092634771244183_n.jpg?stp=dst-jpg_tt6&cstp=mx1440x1440&ctp=s960x960&_nc_cat=100&_nc_map=urlgen_bucketless&ccb=1-7&_nc_sid=5fad0e&_nc_ohc=BCiv6EmH1YsQ7kNvwHoaxwU&_nc_oc=Adplj8Dz736xLVzsUudeVX_PeCO7UdB6OQwvePi8XPz07qKezxiDplmAtBqVatDx9bV_yU0qJegqGlUj_13coDhy&_nc_zt=23&_nc_ht=scontent.fsgn5-21.fna&_nc_gid=6akj6qdGqH6UUaTc1dc8Aw&_nc_ss=7b2a8&oh=00_Af93GP-wa-pLxNzkOhWmcpG7-5UyxiBn25M4UKKP3ZvvrA&oe=6A43DDD7 | https://scontent.fsgn5-21.fna.fbcdn.net/v/t39.2093-6/719252475_3228018317385785_3279325739400302265_n.srt?_nc_cat=101&_nc_map=urlgen_bucketless&ccb=1-7&_nc_sid=c211c2&_nc_ohc=Rf2_AIc3h5QQ7kNvwHEoEsR&_nc_oc=Adq1z3uXfwX3QBOyqFVTo31GKJbXftTOAVroEC4wIgO7PUMMunFJdT6DXyfPTX8OHdicw7pkYuDOhnp7Is9GTskj&_nc_zt=14&_nc_ht=scontent.fsgn5-21.fna&_nc_gid=6akj6qdGqH6UUaTc1dc8Aw&_nc_ss=7b2a8&oh=00_Af-DAUfDndKPE0UlPmnmO_7YtkNePCbhDTloKYH7RPvG6A&oe=6A43E7E9 | https://scontent.fsgn5-21.fna.fbcdn.net/o1/v/t2/f2/m412/AQOMvhqhX4HKJveq_piy2dr3O9iZWaEgznV89CInCBUnOWM5tgHo99Yl_9M53iMDt4bV4HLF7cAxejIWUdYA4Qw2CHStyGDnvMkkZ5tvDg.mp4?_nc_cat=100&_nc_oc=Adppdi3HcBZePZ-RE8EnoWvwAcdLx43rM-0vN7lTvH7sRUXn9yDmhfNLGcMe3eH3ammGLLoRK_fPaed-UJnA4iRJ&_nc_sid=8bf8fe&_nc_ht=scontent.fsgn5-21.fna.fbcdn.net&_nc_ohc=MhuQf1_SmlkQ7kNvwGngeOQ&efg=eyJ2ZW5jb2RlX3RhZyI6Inhwdl9wcm9ncmVzc2l2ZS5GQUNFQk9PSy4uQzMuMzYwLnN2ZV9zZCIsInhwdl9hc3NldF9pZCI6ODcwMTMxMzM2MTM4NTE3LCJhc3NldF9hZ2VfZGF5cyI6MTYsInZpX3VzZWNhc2VfaWQiOjEwMTIyLCJkdXJhdGlvbl9zIjoxMSwidXJsZ2VuX3NvdXJjZSI6Ind3dyJ9&ccb=17-1&_nc_gid=6akj6qdGqH6UUaTc1dc8Aw&_nc_ss=7b2a8&_nc_map=urlgen_bucketless&_nc_zt=28&oh=00_Af9QqhTf6Y8ZJBnobNiQbrHv2MkcsRNUglXzKzO10jeh4Q&oe=6A43DA6A&bitrate=175599&tag=sve_sd | https://scontent.fsgn5-6.fna.fbcdn.net/o1/v/t2/f2/m366/AQMDqLweCtFVbejfBOoVdvhGRq6rG0s5xgotsw-Wg-KXZjba4bf4TcX4ctCo5A4b6oUFGsqstQObX9lYZT7vloy_mKykJ8WJZD5VmV4ZzgylqQ.mp4?_nc_cat=111&_nc_oc=AdoJ74OZLHVNzB3GbJt1p11uRx6-BiOHn0TTcB0fkhZetwcQFETAV1_xix3v28IikZ-TG4pQVLFNCKF34E0UTm2_&_nc_sid=5e9851&_nc_ht=scontent.fsgn5-6.fna.fbcdn.net&_nc_ohc=6ZuxMggEX6wQ7kNvwHFrUpG&efg=eyJ2ZW5jb2RlX3RhZyI6Inhwdl9wcm9ncmVzc2l2ZS5GQUNFQk9PSy4uQzMuNzIwLmRhc2hfaDI2NC1iYXNpYy1nZW4yXzcyMHAiLCJ4cHZfYXNzZXRfaWQiOjg3MDEzMTMzNjEzODUxNywiYXNzZXRfYWdlX2RheXMiOjE2LCJ2aV91c2VjYXNlX2lkIjoxMDEyMiwiZHVyYXRpb25fcyI6MTEsInVybGdlbl9zb3VyY2UiOiJ3d3cifQ%3D%3D&ccb=17-1&vs=95cb5a8360695153&_nc_vs=HBksFQIYRWZiX2VwaGVtZXJhbC8yMjQ5OTEzOUEyMDFFQ0FGQzlDREM1RkU0MkExM0Y4M19tdF8xX3ZpZGVvX2Rhc2hpbml0Lm1wNBUAAsgBEgAVAhhAZmJfcGVybWFuZW50LzEwNEQ2MEQ5QUNCOTM3Q0VCNkNEN0I0MDM4REY0NkI1X2F1ZGlvX2Rhc2hpbml0Lm1wNBUCAsgBEgAoABgAGwKIB3VzZV9vaWwBMRJwcm9ncmVzc2l2ZV9yZWNpcGUBMRUAACaqvJbTp9iLAxUCKAJDMywXQCYAAAAAAAAYGWRhc2hfaDI2NC1iYXNpYy1nZW4yXzcyMHARAHUCZZSeAQA&_nc_gid=6akj6qdGqH6UUaTc1dc8Aw&_nc_ss=7b2a8&_nc_map=urlgen_bucketless&_nc_zt=28&oh=00_Af-34Wr2N_7mMm7-kqC1XjAE5AWs2mDhaMchEh3P_oqg9Q&oe=6A43CE99&bitrate=552893&tag=dash_h264-basic-gen2_720p | https://scontent.fsgn5-21.fna.fbcdn.net/v/t15.5256-10/718111528_1032299752566661_2896092634771244183_n.jpg?stp=dst-jpg_tt6&cstp=mx1440x1440&ctp=s960x960&_nc_cat=100&_nc_map=urlgen_bucketless&ccb=1-7&_nc_sid=50ce42&_nc_ohc=BCiv6EmH1YsQ7kNvwHoaxwU&_nc_oc=Adplj8Dz736xLVzsUudeVX_PeCO7UdB6OQwvePi8XPz07qKezxiDplmAtBqVatDx9bV_yU0qJegqGlUj_13coDhy&_nc_zt=23&_nc_ht=scontent.fsgn5-21.fna&_nc_gid=6akj6qdGqH6UUaTc1dc8Aw&_nc_ss=7b2a8&oh=00_Af93GP-wa-pLxNzkOhWmcpG7-5UyxiBn25M4UKKP3ZvvrA&oe=6A43DDD7 | https://scontent.fsgn5-9.fna.fbcdn.net/v/t15.5256-10/718174274_2023308881619268_6072269057346940743_n.jpg?stp=dst-jpg_tt6&cstp=mx1000x1000&ctp=s1000x1000&_nc_cat=104&_nc_map=urlgen_bucketless&ccb=1-7&_nc_sid=06012f&_nc_ohc=q5ZBBG1GA2oQ7kNvwHyo8V9&_nc_oc=Adr9v_QpElTeuI6cArm0RKPYwW9xWWGRZ_RU2_y8i_YeIRcOKXAlCQ9-OZ1unyFUFqk09jFzwPxaGmPkfxIAofXO&_nc_zt=23&_nc_ht=scontent.fsgn5-9.fna&_nc_gid=6akj6qdGqH6UUaTc1dc8Aw&_nc_ss=7b2a8&oh=00_Af_xpCZfe8nDmxltGf6488CAUjrrAXGWR3vtJeO0_tqkdg&oe=6A43BFE4,https://www.facebook.com/reel/1592002759005114/
2026-06-09,"✨Tư vấn viên tài chính Chubb Life: từng bước xây niềm tin, toàn tâm bảo vệ khách hàng.   Đằng sau mỗi hợp đồng bảo hiểm không chỉ là một giải pháp tài chính. ✅Đó còn là những cuộc trò chuyện chân thành - lắng nghe sâu, hiểu mọi lo âu  ✅Là sự thấu cảm những trăn trở chưa từng được nói thành lời ✅Là những buổi tư vấn tận tâm để khách hàng đưa ra quyết định phù hợp ✅Và là sự đồng hành bền bỉ trong từng khoảnh khắc sống  📗Các Tư vấn viên tài chính Chubb Life không chỉ cung cấp một sản phẩm, mà còn đang từng ngày xây nên hệ giá trị bảo vệ cho người Việt ở khắp mọi nơi. Họ cũng chính là lực lượng tiền tuyến tinh nhuệ - toàn tâm vì sứ mệnh bảo vệ con người và luôn kiên cường chinh phục thành công trong sự nghiệp.   👉Gia nhập Đội ngũ Kinh doanh Chubb Life hôm nay - nơi bạn kiến tạo giá trị thực, phát triển bản thân không ngừng và trao đi an tâm cho người dân trên mọi miền đất nước!   📪Tìm hiểu chi tiết và ứng tuyển ngay tại địa chỉ: https://tuyendung.baohiemchubblife.vn/#/ 💌Hoặc gửi email về hòm thư: GiaNhap.VnLife@chubb.com  #Chubb #ChubbLifeVietnam #BaohiemcoChubblo #Damsongdoitudo",Chubb Life Vietnam,3061,29,249,https://www.facebook.com/BaohiemChubbLifeVietnam,https://www.facebook.com/BaohiemChubbLifeVietnam/posts/pfbid02JZJQwGHgKnDDxKg8chwygKNXr7HRyj1r2NTXAYmgpZMGgBDEfnqP9ZwiDAMXYCGsl,1452742136892812,https://scontent.fsgn5-14.fna.fbcdn.net/v/t39.99422-6/720553138_1034541755814163_3608184700457740215_n.png?stp=dst-jpg_tt6&cstp=mx2000x2000&ctp=s1080x2048&_nc_cat=106&_nc_map=urlgen_bucketless&ccb=1-7&_nc_sid=833d8c&_nc_ohc=4313vYlMRxUQ7kNvwGVR877&_nc_oc=AdqleVJ7ZFtb66mYLBg73JEU4blTyss4259X4cwSJRlVwfcIe_6_3wS7jHd9hjGTkcf8fJaCM31-hOfdyPfEyOEZ&_nc_zt=14&_nc_ht=scontent.fsgn5-14.fna&_nc_gid=6akj6qdGqH6UUaTc1dc8Aw&_nc_ss=7b2a8&oh=00_Af8Ukyl8fXPsSzxKKjgY1ZxHxsjk8U3CBm_LQBAA4rhLng&oe=6A43BEED,
2026-06-09,"Chubb Life hợp tác cùng LIMRA phát triển năng lực quản lý theo chuẩn quốc tế, hướng đến nâng tầm chất lượng và phục vụ khách hàng tốt hơn.  Vừa qua, tại TP.HCM, Chubb Life Việt Nam đã phối hợp cùng Tổ chức LIMRA (Hoa Kỳ) chính thức triển khai chuỗi huấn luyện đặc biệt dành cho đội ngũ quản lý kinh doanh. Sự kiện quy tụ nhiều Giám đốc Kinh doanh xuất sắc trên toàn quốc tham gia hai khóa đào tạo trọng điểm: “Fast Track to Management” và “Pacesetter”.  Không chỉ dừng lại ở một khóa học đơn thuần, việc triển khai chuỗi chương trình đào tạo từ Tổ chức LIMRA (Hoa Kỳ) là bước đi mang tính chiến lược của Chubb Life Việt Nam nhằm nâng cao năng lực đội ngũ kinh doanh, hướng đến nâng tầm hiệu suất hoạt động và phục vụ khách hàng tốt hơn.  Bước sang năm thứ 21 có mặt tại Việt Nam, Chubb Life không chỉ cam kết củng cố vững chắc nội lực để phát triển bền vững mà còn góp phần nâng cao vị thế và tính chuyên nghiệp của toàn ngành bảo hiểm nhân thọ tại Việt Nam.  #Chubb #ChubbLifeVietnam #BaohiemcoChubbLo #Damsongdoitudo",Chubb Life Vietnam,117,22,18,https://www.facebook.com/BaohiemChubbLifeVietnam,https://www.facebook.com/BaohiemChubbLifeVietnam/posts/pfbid02qkoYdGVUUqotc9seETgtxNvE7MoeN2g6EzCKNX39CwY8dyn97fZwMryHoc5ijfTel,1452348960265463,https://scontent.fsgn5-9.fna.fbcdn.net/v/t39.99422-6/720228011_1317537299922252_6624365052443596583_n.png?stp=dst-jpg_tt6&cstp=mx1440x1440&ctp=s1440x1440&_nc_cat=102&_nc_map=urlgen_bucketless&ccb=1-7&_nc_sid=833d8c&_nc_ohc=BotuD3APiEoQ7kNvwHLFP8i&_nc_oc=AdrK_Lpn5UM2OCA47vfw_kttwoig27114EnkX5Uu_eO_Dx23BW4r57-sAK5kyFjsDahIqmSRPL_6mI_JlRfJeCKH&_nc_zt=14&_nc_ht=scontent.fsgn5-9.fna&_nc_gid=6akj6qdGqH6UUaTc1dc8Aw&_nc_ss=7b2a8&oh=00_Af_hFQ01xXfmxvHXz9029w4diTzOK55lIq2nlQoCn62Rqw&oe=6A43C6CE | https://scontent.fsgn5-2.fna.fbcdn.net/v/t39.99422-6/714871483_1558536505636089_8952883512778793472_n.png?stp=dst-jpg_tt6&cstp=mx1440x1440&ctp=s1440x1440&_nc_cat=109&_nc_map=urlgen_bucketless&ccb=1-7&_nc_sid=833d8c&_nc_ohc=35MoBitRwfEQ7kNvwE4y1iv&_nc_oc=Ado5cstUZzTaPk4gtdu2H3bxl-6W81BnKvGcJ7BrWKRJgpaFK9d3M-6W21ReFWt-_7LVRnruR7GiR8kYDvjavGQ5&_nc_zt=14&_nc_ht=scontent.fsgn5-2.fna&_nc_gid=6akj6qdGqH6UUaTc1dc8Aw&_nc_ss=7b2a8&oh=00_Af9B6W9eDZQLAlb839SaSb5qb38NnWNWhbkm_1WPx2usfw&oe=6A43CCBC | https://scontent.fsgn5-9.fna.fbcdn.net/v/t39.99422-6/720057756_1726635215439795_3126477436299221770_n.png?stp=dst-jpg_tt6&cstp=mx1440x1440&ctp=s1440x1440&_nc_cat=109&_nc_map=urlgen_bucketless&ccb=1-7&_nc_sid=833d8c&_nc_ohc=sa3dTIB-ZXoQ7kNvwFpJnSO&_nc_oc=Adp1jj9mLm8cGBe3F27pMb58PkY8tgOOJR2cB55jKkfyP-S6Hwp6wJfZrVSw1nRZmFhuQ5GnBFO4oD-C7-Ehfr0O&_nc_zt=14&_nc_ht=scontent.fsgn5-9.fna&_nc_gid=6akj6qdGqH6UUaTc1dc8Aw&_nc_ss=7b2a8&oh=00_Af_XddwdtH1Iud4E_g-l_gIQ1WPH1HDrT3rflKUfn4-9Vw&oe=6A43CA5A | https://scontent.fsgn5-11.fna.fbcdn.net/v/t39.99422-6/720906024_897149623393303_841638981685405214_n.png?stp=dst-jpg_tt6&cstp=mx1440x1440&ctp=s1440x1440&_nc_cat=103&_nc_map=urlgen_bucketless&ccb=1-7&_nc_sid=833d8c&_nc_ohc=cdVXmWqms_EQ7kNvwFtz-6E&_nc_oc=Adr0UA1WHfFG2LHU4c1vsqyX9HOV2PpbmNWzLl1n8TXS1y4XVv4xcAq5JYWZIe_gdWLKp4yidkkLOPBPWLmWkPn-&_nc_zt=14&_nc_ht=scontent.fsgn5-11.fna&_nc_gid=6akj6qdGqH6UUaTc1dc8Aw&_nc_ss=7b2a8&oh=00_Af_hBFs7m6mLzvRHAHiP3Mc1UaEgXFiflfuZqqnz-pbJNg&oe=6A43E6A0,
2026-06-08,"✨Điều tạo nên khác biệt không phải bạn đến từ đâu, mà là bạn sẵn sàng đi xa đến đâu.  📊Xuất phát điểm cho bạn điểm tựa để vươn cao, nhưng chính nỗ lực, niềm tin và kỉ luật hành động mới tạo ra chất liệu cho thành công bền vững.  Tại Chubb Life Việt Nam, chúng tôi hướng đến việc xây dựng một Đội ngũ Kinh doanh toàn tâm - chuẩn mực - tin cậy, nơi mỗi Chuyên viên tư vấn tài chính không chỉ làm “nghề bảo hiểm”, mà còn là người bạn tâm giao của mỗi khách hàng.   Gia nhập Chubb Life Việt Nam để trở thành những chuyên gia mà Khách hàng đặt trọn niềm tin. Vì đã có Chubb lo - bạn tự do vươn xa sự nghiệp, với:  ⚡ Chương trình đào tạo bài bản giúp xây dựng nền tảng kiến thức tài chính - bảo hiểm vững chắc. ⚡ Lộ trình thăng tiến minh bạch, nơi thành quả được ghi nhận bằng năng lực thực sự. ⚡ Môi trường làm việc đề cao sự tôn trọng, hỗ trợ và phát triển dài hạn.  👉Tìm hiểu chi tiết và ứng tuyển ngay tại địa chỉ:  https://tuyendung.baohiemchubblife.vn/#/ Hoặc gửi email về hòm thư: GiaNhap.VnLife@chubb.com   #Chubb #ChubbLifeVietnam #BaohiemcoChubblo #Damsongdoitudo",Chubb Life Vietnam,2825,31,276,https://www.facebook.com/BaohiemChubbLifeVietnam,https://www.facebook.com/BaohiemChubbLifeVietnam/posts/pfbid037rf9Z3bD8ZxcV4XeRKbKoiNL3mDD7wD3ED5P1KyJhZAkn2dnjWA9Am9FdBk8t8ovl,1451880696978956,https://scontent.fsgn5-13.fna.fbcdn.net/v/t39.99422-6/710827588_2226010838144246_4486601443308470713_n.png?stp=dst-jpg_tt6&cstp=mx1500x1500&ctp=s1500x1500&_nc_cat=105&_nc_map=urlgen_bucketless&ccb=1-7&_nc_sid=833d8c&_nc_ohc=YvG4tNzDFREQ7kNvwHbl9_b&_nc_oc=AdqfJwQGUHfRoclmM5yZjxO5u0SBdJWiixf4oz_TGKvoZTW5SHdNSHNd70yOf4XLPbrr78EM_pq5ifA8CgU82BpP&_nc_zt=14&_nc_ht=scontent.fsgn5-13.fna&_nc_gid=YvICBFYr-K2IXuXsWV7r4Q&_nc_ss=7b2a8&oh=00_Af_WIFj67Y2gfXtjcOqOpe3UiR2GbW3KVFBFczCpImayew&oe=6A43DD81 | https://scontent.fsgn5-9.fna.fbcdn.net/v/t39.99422-6/718857169_892050197254379_7853681785779359730_n.png?stp=dst-jpg_tt6&cstp=mx1500x1500&ctp=s1500x1500&_nc_cat=103&_nc_map=urlgen_bucketless&ccb=1-7&_nc_sid=833d8c&_nc_ohc=8AnpCGSfwooQ7kNvwHAEqkQ&_nc_oc=Adqc8xK8HXkrkPwHQJlcHQW9dneE5Hsojonr4UfQ31m-ApsoHYs4YiQQfEnEtFm_D7RZdJelu_vnsQpar_xwyjgD&_nc_zt=14&_nc_ht=scontent.fsgn5-9.fna&_nc_gid=YvICBFYr-K2IXuXsWV7r4Q&_nc_ss=7b2a8&oh=00_Af9XjbVjqbGkaHd34mJruNYSJFm9QO336_nCx8QfyL3AAw&oe=6A43EF88 | https://scontent.fsgn5-8.fna.fbcdn.net/v/t39.99422-6/717425145_2008599730048775_9071668507227579229_n.png?stp=dst-jpg_tt6&cstp=mx999x999&ctp=s999x999&_nc_cat=110&_nc_map=urlgen_bucketless&ccb=1-7&_nc_sid=833d8c&_nc_ohc=Z0fZB2yMY84Q7kNvwF3CTLS&_nc_oc=AdrZMiDs14sTfDMCpd5IQ_GitbNyKBzQLn9ttQ4E1jEef6fj8n1Vc1ScapOttx_Kjn73reCAWUX3CPmCB-5FSTGG&_nc_zt=14&_nc_ht=scontent.fsgn5-8.fna&_nc_gid=YvICBFYr-K2IXuXsWV7r4Q&_nc_ss=7b2a8&oh=00_Af_tvBej9s-P-C0WAZ1Z_Jukk8fKHukxpzuE3ljFWebptg&oe=6A43EC8F | https://scontent.fsgn5-1.fna.fbcdn.net/v/t39.99422-6/717994763_1032715282510188_3287696360838184589_n.png?stp=dst-jpg_tt6&cstp=mx999x999&ctp=s999x999&_nc_cat=106&_nc_map=urlgen_bucketless&ccb=1-7&_nc_sid=833d8c&_nc_ohc=xFstBuhX9cQQ7kNvwHAbJuN&_nc_oc=AdrUa38BQ7N70sUM2rgWC4n98XG-aCi3LpGiKA6ACi2LyO8E48E5L_bDjpPRuwkYA_nGSywIjW-SzTOv7-Jcc2Ke&_nc_zt=14&_nc_ht=scontent.fsgn5-1.fna&_nc_gid=YvICBFYr-K2IXuXsWV7r4Q&_nc_ss=7b2a8&oh=00_Af8ftSgxQBdOSjrJUFL2wL7zOJcFiQ7Tp6N0D_U4kI4wQQ&oe=6A43C093 | https://scontent.fsgn5-13.fna.fbcdn.net/v/t39.99422-6/719218759_1516244859949378_3816957427052885121_n.png?stp=dst-jpg_tt6&cstp=mx999x999&ctp=s999x999&_nc_cat=101&_nc_map=urlgen_bucketless&ccb=1-7&_nc_sid=833d8c&_nc_ohc=l_GxZSFqKsUQ7kNvwGaZaVg&_nc_oc=AdrZ6oI2snyiZ7UVDKR_ClcENhhRMxiYMvs2Ol0kO-yAlD0tV6YsKheMXkhrqrj3Rt0xXY4iBobiMb4KLNcaL-nd&_nc_zt=14&_nc_ht=scontent.fsgn5-13.fna&_nc_gid=YvICBFYr-K2IXuXsWV7r4Q&_nc_ss=7b2a8&oh=00_Af96UUA4iy7KMY6-A1Dk2Yk5AXos0hMRN5VsJFaHtdsOUQ&oe=6A43C891,
2026-06-06,"21 năm Chubb Life Vietnam: Bảo vệ để bạn tự do là chính mình.   Có người nghĩ tự do là được làm bất cứ điều gì mình muốn. Nhưng khi trưởng thành, ta nhận ra: Tự do còn là cảm giác dám bước tới mà không phải luôn ngoái nhìn phía sau.  ✨Sẵn sàng theo đuổi điều mình tin. ✨Tự tin sống theo cách mình chọn. ✨Và dám sống vì tương lai.   Suốt 21 năm qua, Chubb Life tự hào kiến tạo nền tảng bảo vệ vững chắc, để bạn được tỏa sáng trong phiên bản vô lo của chính mình.   Bảo hiểm có Chubb lo - Dám sống đời tự do  #Chubb #ChubbLifeVietnam #BaohiemcoChubblo #Damsongdoitudo",Chubb Life Vietnam,163,30,285,https://www.facebook.com/BaohiemChubbLifeVietnam,https://www.facebook.com/reel/1017809477858711/,1449998030500556,https://scontent.fsgn5-5.fna.fbcdn.net/v/t15.5256-10/717168123_981631581381820_2679070986646209667_n.jpg?stp=dst-jpg_tt6&cstp=mx1440x1440&ctp=s960x960&_nc_cat=100&_nc_map=urlgen_bucketless&ccb=1-7&_nc_sid=5fad0e&_nc_ohc=vZgZABEtMn0Q7kNvwGAhB6k&_nc_oc=AdqnFuYQexe49g9vqVZOkrKP9gB9V0vJANrI8ZYI6OWkq2nL5yKImj-xivEVa6U64Zyp07bR4fpsnN1vM_O9QJoM&_nc_zt=23&_nc_ht=scontent.fsgn5-5.fna&_nc_gid=YvICBFYr-K2IXuXsWV7r4Q&_nc_ss=7b2a8&oh=00_Af9BBL5EBCI_oXyHEvyx9rIZrRY_v2bi_bT075wj9SJxwA&oe=6A43B9B4 | https://scontent.fsgn5-10.fna.fbcdn.net/v/t39.2093-6/716650276_1017810891191903_57846067932685218_n.srt?_nc_cat=105&_nc_map=urlgen_bucketless&ccb=1-7&_nc_sid=c211c2&_nc_ohc=v6nvOK5KDAcQ7kNvwGbBL9z&_nc_oc=AdpEyfELprPMjq9YBCuHX4kHvf00fEJy3gIBOWkkhxW6AaCbmsxnNRmIW_VLnVpWfmD6PEjyKEhLESP06JiU8qYf&_nc_zt=14&_nc_ht=scontent.fsgn5-10.fna&_nc_gid=YvICBFYr-K2IXuXsWV7r4Q&_nc_ss=7b2a8&oh=00_Af-xpYP-9lrjZ9ol9sjoIRLfQ9ICO_BQc1qyl5LW6bdBjg&oe=6A43BCD6 | https://scontent.fsgn5-6.fna.fbcdn.net/o1/v/t2/f2/m412/AQPwnqXit-KEd_qCPoz-aA-X3W1IJ8V-CVkol0z4rxw2-OiCDgZFm07qJSQS3awBHaig5Z27NTtydMolrjh4kc95hBub5qLFWf5l2z05_A.mp4?_nc_cat=106&_nc_oc=Adp319n44QqBkxZLQTdQQzWShMHz_qqrmrBfqTb6oaFlf78tkSU5vN0wkQRMtgw9Kp6yMRbSeAsAkODlxrxFzez8&_nc_sid=8bf8fe&_nc_ht=scontent.fsgn5-6.fna.fbcdn.net&_nc_ohc=pd5l5n-Ipd0Q7kNvwFWk-pB&efg=eyJ2ZW5jb2RlX3RhZyI6Inhwdl9wcm9ncmVzc2l2ZS5GQUNFQk9PSy4uQzMuMzYwLnN2ZV9zZCIsInhwdl9hc3NldF9pZCI6MTM2MzUwMjkzODk5NDY4MSwiYXNzZXRfYWdlX2RheXMiOjE5LCJ2aV91c2VjYXNlX2lkIjoxMDEyMiwiZHVyYXRpb25fcyI6MTAsInVybGdlbl9zb3VyY2UiOiJ3d3cifQ%3D%3D&ccb=17-1&_nc_gid=YvICBFYr-K2IXuXsWV7r4Q&_nc_ss=7b2a8&_nc_map=urlgen_bucketless&_nc_zt=28&oh=00_Af_BQapHcJ7OxS5ecYG3QFIYr3-YxK6pz5Bpt98GqpDQ9w&oe=6A43E580&bitrate=166293&tag=sve_sd | https://scontent.fsgn5-10.fna.fbcdn.net/o1/v/t2/f2/m366/AQOKPI5K86sO9A503LsVjlLAwMtGKRLxyaLPwoaHqexFflPvVPd8H4VQ-H6GJ4hJwyBkgldb06CHbH7aU2szznpbkugq-5zPhbTOywODLM7XBg.mp4?_nc_cat=100&_nc_oc=AdpiBK1wGzNNsaIGPcjBEgVniIrij58HhPQSuR9xnvIiL8PzNt-jnrpuhOx_OLYGQ7Da3II0NXullB1mvo8TICW9&_nc_sid=5e9851&_nc_ht=scontent.fsgn5-10.fna.fbcdn.net&_nc_ohc=340z2aE9ML8Q7kNvwF4uVG2&efg=eyJ2ZW5jb2RlX3RhZyI6Inhwdl9wcm9ncmVzc2l2ZS5GQUNFQk9PSy4uQzMuNzIwLmRhc2hfaDI2NC1iYXNpYy1nZW4yXzcyMHAiLCJ4cHZfYXNzZXRfaWQiOjEzNjM1MDI5Mzg5OTQ2ODEsImFzc2V0X2FnZV9kYXlzIjoxOSwidmlfdXNlY2FzZV9pZCI6MTAxMjIsImR1cmF0aW9uX3MiOjEwLCJ1cmxnZW5fc291cmNlIjoid3d3In0%3D&ccb=17-1&vs=ffdf148c372e08ea&_nc_vs=HBksFQIYRWZiX2VwaGVtZXJhbC83QjQ0Q0U3NEVEODkxOUVGRTIxNUI1M0NBQjBBQjQ4Nl9tdF8xX3ZpZGVvX2Rhc2hpbml0Lm1wNBUAAsgBEgAVAhhAZmJfcGVybWFuZW50LzgzNDQwMkM3REIzMzA1NUREMjg4RjQ3QTgwRjY5RkFEX2F1ZGlvX2Rhc2hpbml0Lm1wNBUCAsgBEgAoABgAGwKIB3VzZV9vaWwBMRJwcm9ncmVzc2l2ZV9yZWNpcGUBMRUAACby36HFqIbsBBUCKAJDMywXQCXul41P3zsYGWRhc2hfaDI2NC1iYXNpYy1nZW4yXzcyMHARAHUCZZSeAQA&_nc_gid=YvICBFYr-K2IXuXsWV7r4Q&_nc_ss=7b2a8&_nc_map=urlgen_bucketless&_nc_zt=28&oh=00_Af9wDSzecM2G-W_fwptdfS66j39S_aZzOPOQMyI0LnEX5A&oe=6A43B92C&bitrate=538482&tag=dash_h264-basic-gen2_720p | https://scontent.fsgn5-5.fna.fbcdn.net/v/t15.5256-10/716897562_1519785523142444_6625797612903805457_n.jpg?stp=dst-jpg_tt6&cstp=mx1440x1440&ctp=s960x960&_nc_cat=105&_nc_map=urlgen_bucketless&ccb=1-7&_nc_sid=50ce42&_nc_ohc=fUamWAFFABwQ7kNvwFAnnpi&_nc_oc=AdqNCaHTRlhPaL_dyoEthusDEYHKN3KBKPfYYGMvlMQTzXTegreSbglJV4zpEfA1hub_8KbxXDfshWLi42FKTdXC&_nc_zt=23&_nc_ht=scontent.fsgn5-5.fna&_nc_gid=YvICBFYr-K2IXuXsWV7r4Q&_nc_ss=7b2a8&oh=00_Af9Ebk9q7q1Q9eBGs6qhO2c7ONTpjxD5vHFn1D1gl9qnDA&oe=6A43DAA2 | https://scontent.fsgn5-22.fna.fbcdn.net/v/t15.5256-10/717709109_1325408505598818_2601803150194915490_n.jpg?stp=dst-jpg_tt6&cstp=mx1000x1000&ctp=s1000x1000&_nc_cat=111&_nc_map=urlgen_bucketless&ccb=1-7&_nc_sid=06012f&_nc_ohc=5SL1nbSzBcIQ7kNvwEm7r7T&_nc_oc=AdoQjjhHO19HsGY214C4oqjZOU98DX3bwUfFD20uf8K2UPnAF_FDUDPcUQCfchAVtV8EGhSUB4LpzhrxBw5mFv46&_nc_zt=23&_nc_ht=scontent.fsgn5-22.fna&_nc_gid=YvICBFYr-K2IXuXsWV7r4Q&_nc_ss=7b2a8&oh=00_Af_tzOJJlXNyyrw8ZVbg2trSpqYLCA1ckVxTXHZBIyj9Mw&oe=6A43D99E,https://www.facebook.com/reel/1017809477858711/
2026-06-04,"🌿 CHÚC MỪNG NGÀY MÔI TRƯỜNG THẾ GIỚI 05/06/2026  Bảo vệ ENVIRONMENT chính là ÊM-VUI-DO-MÌNH. Bạn nghĩ sao về góc nhìn này? Hãy cùng Chubb Life ngẫm thử nhé!  💡 Có những chiếc đèn vẫn sáng dù chẳng còn ai trong phòng. ️🛒 Có những món đồ được mua về rồi cất tủ chỉ vì một phút cảm xúc. ️🍲 Có những bữa ăn gọi nhiều bất thường vì nhầm lẫn giữa thèm và đói. Đằng sau những lãng phí tưởng chừng rất nhỏ ấy thường là một điều lớn hơn: Chúng ta chưa thật sự hiểu điều mình cần. Bởi khi hiểu mình hơn, ta lựa chọn đúng hơn, sống có chủ đích và tiêu dùng vừa đủ hơn. Và khi mỗi người giảm đi một chút lãng phí, môi trường sẽ được bảo vệ tốt hơn.  🌏 Nhân Ngày Môi trường Thế giới, Chubb Life chúc bạn luôn tìm thấy trạng thái “Êm Vui Do Mình” - hiểu rõ bản thân để sống cân bằng, đủ đầy và có ý thức hơn mỗi ngày. Chọn ít hơn những điều không cần thiết. Và nhiều hơn những điều thực sự có ý nghĩa cho cuộc sống và tương lai.  Bảo hiểm có Chubb lo – Dám sống đời tự do.  #Chubb #ChubbLife #ChubbLifeVietnam #BaoHiemCoChubbLo #DamSongDoiTuDo",Chubb Life Vietnam,1445,29,247,https://www.facebook.com/BaohiemChubbLifeVietnam,https://www.facebook.com/BaohiemChubbLifeVietnam/posts/pfbid0ZFFSEGEc8N8NPePtL9JbDfV8eBsqB2GVbPYsXTpCVAXEzB3r5y1oFcUBLJzeZSz4l,1448136654020027,https://scontent.fsgn5-21.fna.fbcdn.net/v/t39.30808-6/714689357_1448135834020109_1742742109292959873_n.jpg?stp=dst-jpg_tt6&cstp=mx2000x2000&ctp=s1080x2048&_nc_cat=108&_nc_map=urlgen_bucketless&ccb=1-7&_nc_sid=127cfc&_nc_ohc=ZnnZV35hu34Q7kNvwGKX65h&_nc_oc=AdooVlj3f8q6k0V0rJgV3FKdhD0j6Ngc61xtbqCtpXUwgZcWtLrevS5KGGK-NqEFJtzJ8G55pvmZYgMdwLdtsR6S&_nc_zt=23&_nc_ht=scontent.fsgn5-21.fna&_nc_gid=YvICBFYr-K2IXuXsWV7r4Q&_nc_ss=7b2a8&oh=00_Af-zCuH3FLloAz2ua7FNYsErNZaLMyREOhZxqwXOu6IcLg&oe=6A43CA2F,
