post_date,content,fanpage_name,reaction,share,comment,fanpage_url,post_url,post_id,image_urls,video_url
2026-06-26,"🏆 Ai cũng có thể trở thành “Nhà vô địch” với một kế hoạch bảo vệ “khung thành cuộc sống”! BẰNG CÁCH NÀO? 👇👇👇  ⚽ 3 bước để xây dựng kế hoạch tài chính thông minh cho “Nhà vô địch”:  🥅 Bước 1: Hiểu rõ nhu cầu bảo vệ của gia đình Mỗi gia đình có những ưu tiên trong cuộc sống khác nhau. Hiểu đúng nhu cầu là nền tảng để xây dựng giải pháp phù hợp.  🥅 Bước 2: Xây dựng kế hoạch theo từng giai đoạn cuộc sống Từ những năm tháng con khôn lớn, học tập, trưởng thành đến tương lai của cả gia đình, mỗi cột mốc đều cần được chuẩn bị ngay từ hôm nay.  🥅 Bước 3: Đồng hành cùng chuyên gia để hiện thực hóa kế hoạch Một kế hoạch hiệu quả không chỉ nằm trên giấy, mà còn cần được hiện thực hóa bằng những giải pháp phù hợp với mục tiêu bảo vệ và khả năng tài chính của gia đình.  🏆 Đừng chờ đến khi “thủng lưới” mới nghĩ đến một kế hoạch bảo vệ. Vì “Nhà vô địch” không đặt cược vào may mắn, mà đặt niềm tin vào sự chuẩn bị của chính mình!   #Chubb #ChubbLifeVietnam #BaohiemcoChubblo #Damsongdoitudo",Chubb Life Vietnam,11,2,0,https://www.facebook.com/BaohiemChubbLifeVietnam,https://www.facebook.com/BaohiemChubbLifeVietnam/posts/pfbid0bm9w6GCcGhCoRWtgmhEoutgRSW5AJwA297dtj3VB9BVdRfTVp2sn6CRqyHLEgth1l,1467748778725481,https://scontent.fsgn5-1.fna.fbcdn.net/v/t39.99422-6/730109319_1018250707833106_7148331637509068657_n.png?stp=dst-jpg_tt6&cstp=mx1500x1500&ctp=s1500x1500&_nc_cat=105&_nc_map=urlgen_bucketless&ccb=1-7&_nc_sid=127cfc&_nc_ohc=Sgw84UdeGpgQ7kNvwFjME_K&_nc_oc=AdogU-j5lslZ8N79W0RxGbJUtdblg4Zcig8qzZXkwGadlPAAYe_JZXKQL8c7Ug-t2a0iGrrJj3dwfns3Y6Wc9Gce&_nc_zt=14&_nc_ht=scontent.fsgn5-1.fna&_nc_gid=86fUfCcb7fe22INOuKw2yw&_nc_ss=7b2a8&oh=00_Af_4t8rzwiYTTc1HsLyNHrGX7_flj6ZZTkWg95_mF-p41g&oe=6A43DF9F | https://scontent.fsgn5-22.fna.fbcdn.net/v/t39.99422-6/730109623_2144045199867987_7413092493994658168_n.png?stp=dst-jpg_tt6&cstp=mx1500x1500&ctp=s1500x1500&_nc_cat=109&_nc_map=urlgen_bucketless&ccb=1-7&_nc_sid=127cfc&_nc_ohc=kpTFJc1Dgx0Q7kNvwE-YIZa&_nc_oc=Adr9ghiBSmAbjhfVlR31SZPYuh-VQKy-rNsfOaR6qdqyT-TYiTkqM4jR3zZ07CGxrQyppbvbWHFqdOy4UXGomFt6&_nc_zt=14&_nc_ht=scontent.fsgn5-22.fna&_nc_gid=86fUfCcb7fe22INOuKw2yw&_nc_ss=7b2a8&oh=00_Af_N7YkIwpEoyfDPo4jVNxo9kWfZfjADAdj9MJnyVpIl2w&oe=6A43CA2C | https://scontent.fsgn5-5.fna.fbcdn.net/v/t39.99422-6/731334938_1832108261086822_6067313501942125074_n.png?stp=dst-jpg_tt6&cstp=mx1500x1500&ctp=s1500x1500&_nc_cat=107&_nc_map=urlgen_bucketless&ccb=1-7&_nc_sid=127cfc&_nc_ohc=b9Upc16qYZ4Q7kNvwHiS2-2&_nc_oc=AdrTVDUekP17C02yjODXTyqgQSx2Vk-lWKkxBV8258oBkyUv84Yx66IRyIrZYEc1J3jysbjLnNWrZvGqkR-GDTba&_nc_zt=14&_nc_ht=scontent.fsgn5-5.fna&_nc_gid=86fUfCcb7fe22INOuKw2yw&_nc_ss=7b2a8&oh=00_Af9vNfuJhLrKwthPqxgZBZz3UJg8Wwc6PvsY2sZOd8uZZw&oe=6A43ECDD | https://scontent.fsgn5-22.fna.fbcdn.net/v/t39.99422-6/732018828_37187730884158578_6466486712876573694_n.png?stp=dst-jpg_tt6&cstp=mx1500x1500&ctp=s1500x1500&_nc_cat=106&_nc_map=urlgen_bucketless&ccb=1-7&_nc_sid=127cfc&_nc_ohc=ivOEbXJ4GQYQ7kNvwGf26yF&_nc_oc=Adr5L-8F9pRY2L8rUQUW8WYNcuFCA4t1tI0_gMkRKrcU3SzJK_c-eGG3jd6vJRxSYm-jvFczNIdVN7rkVB-JnDqW&_nc_zt=14&_nc_ht=scontent.fsgn5-22.fna&_nc_gid=86fUfCcb7fe22INOuKw2yw&_nc_ss=7b2a8&oh=00_Af-WMZ2JKEWB0b0phUKsD4dCLcxigX-tCEuK584KEDGcXw&oe=6A43D9A2,
2026-06-25,"💰Dùng tiền mua những điều “thịnh hành” hay xây dựng “thịnh vượng” dài lâu, bạn chọn hướng đi nào?   💠Giữa năm tháng tuổi trẻ, quyết định tài chính luôn gắn liền với những điều mà ta đam mê: một chuyến đi bất chợt, một món đồ đang “hot”, một trải nghiệm theo xu hướng không thể bỏ lỡ.  ✅Không sai!  Vì tuổi trẻ là những lần sống hết mình với hiện tại.  Nhưng rồi trưởng thành mang đến cho ta một bài học khác không kém phần thú vị: dùng tiền để bảo vệ tài sản và xây đắp thịnh vượng cho tương lai, cũng là một loại trải nghiệm rất “đáng”.   🛡️Vì trưởng thành không phải ngừng tận hưởng, mà là chọn cuộc sống cân bằng và nghĩ xa hơn, bền hơn, chắc chắn hơn - cho bản thân và cả những người mà ta trân quý.   👉Chubb Life trân trọng giới thiệu hành trình “Hiểu Bảo Vệ”, mở ra những góc nhìn đa chiều về “Thịnh vượng” - thành tố quan trọng làm nên cuộc sống tự do của chính bạn!  Hãy tìm hiểu và lan toả cùng Chubb trong hành trình sắp tới nhé!   #Chubb #ChubbLifeVietnam #BaohiemcoChubblo #Damsongdoitudo #HieuBaoVe",Chubb Life Vietnam,25,6,2,https://www.facebook.com/BaohiemChubbLifeVietnam,https://www.facebook.com/BaohiemChubbLifeVietnam/posts/pfbid0kq7NgK1DJKpunTqauNxJNHmr4dBmfxDhv5DTVTJaotx1vukkL1sASiGBPrFyouhnl,1467251728775186,https://scontent.fsgn5-10.fna.fbcdn.net/v/t39.99422-6/729160663_2101774204018274_3977123646838507819_n.png?stp=dst-jpg_tt6&cstp=mx1440x1440&ctp=s1080x2048&_nc_cat=109&_nc_map=urlgen_bucketless&ccb=1-7&_nc_sid=127cfc&_nc_ohc=WN5vyl7zDVYQ7kNvwHWWpFi&_nc_oc=AdotLmSvhPnxc7GBw9kvzgCMHyJDv7QortX0KyS5iFVKYWWui_KRNRM5LKpQsI_YJWRu-7oTgWxbWehkoQSL-98C&_nc_zt=14&_nc_ht=scontent.fsgn5-10.fna&_nc_gid=ax9rFUQ_1KthqLDmOeC__A&_nc_ss=7b2a8&oh=00_Af8hlA9iTOuPWf49x-Z1NivfjXIeuwR7mdnwzuQE8qHFWg&oe=6A43C513,
2026-06-24,"“HẠNH PHÚC” là gì mà người ta chúc nhau đến tận “trăm năm”?  💌Chắc hẳn bạn đã ít nhất một lần nắn nót dòng chữ “Trăm Năm Hạnh Phúc” để gửi đến một người đặc biệt trong ngày trọng đại của cuộc đời.  Nhưng đã bao giờ bạn tự hỏi: điều gì khiến “hạnh phúc” trở thành lời chúc được gửi gắm nhiều đến vậy? ✨Có lẽ bởi hạnh phúc không chỉ là một khoảnh khắc, mà còn là đích đến của cuộc sống, là hành trình rong chơi cùng tâm thế thoải mái & vô lo - bên những người mà ta yêu thương.  🍚Một bữa cơm còn nóng, một cuộc gọi “về chưa”, một lời hẹn cho ngày cuối tuần… Đó chính là “HẠNH PHÚC” - được bảo vệ và vun vén, cho trăm ngày, trăm tháng, trăm năm.  👉Chubb Life hân hạnh giới thiệu hành trình “Hiểu Bảo Vệ”, mở ra những góc nhìn đa chiều về HẠNH PHÚC - nền móng vững chắc cho cuộc sống tự do và vững vàng hơn mỗi ngày. ——- Hãy cùng đón chờ và lan tỏa những câu chuyện ý nghĩa cùng Chubb Life! BẢO HIỂM CÓ CHUBB LO - DÁM SỐNG ĐỜI TỰ DO  #Chubb #ChubbLifeVietnam #BaohiemcoChubblo #Damsongdoitudo #HieuBaoVe",Chubb Life Vietnam,87,25,20,https://www.facebook.com/BaohiemChubbLifeVietnam,https://www.facebook.com/BaohiemChubbLifeVietnam/posts/pfbid02HTrFXWncwbcQsbqCTHUKvx8xWCspzvFfSQapsZijVBieTtkh4aHUMLwasoJEVRSrl,1466374872196205,https://scontent.fsgn5-12.fna.fbcdn.net/v/t39.99422-6/730104418_1402233011729829_5926663459771703408_n.png?stp=dst-jpg_tt6&cstp=mx2000x2000&ctp=s1080x2048&_nc_cat=110&_nc_map=urlgen_bucketless&ccb=1-7&_nc_sid=127cfc&_nc_ohc=X--r_hsQAF0Q7kNvwFb1Pt1&_nc_oc=AdpY5w9dJdnDy6jChCyfcn8_Mis_mcRqFQTyhjFyS8jy_i1OSa9VOYJxmOuo2CKETbcVwn69wmSNnRMaE7UZWFTN&_nc_zt=14&_nc_ht=scontent.fsgn5-12.fna&_nc_gid=ax9rFUQ_1KthqLDmOeC__A&_nc_ss=7b2a8&oh=00_Af_3TEv_772IKSOfT8uUn6PtkaX9cxFqar1HtNrgJmqaDg&oe=6A43CE11,
2026-06-22,"Có phải chỉ khi đối diện bất an, ta mới hiểu giá trị của sự BÌNH AN? —-  Càng trưởng thành, ta càng nhận ra: dường như không tồn tại khái niệm “cuộc sống bằng phẳng”, chỉ có con người lựa chọn tâm thế an nhiên trước mọi bất trắc của cuộc đời.   🏝️“BÌNH AN” - là cảm giác mọi thứ vẫn ổn, người mình thương vẫn khỏe mạnh, những điều ta trân quý vẫn vẹn tròn. Không hoảng loạn trước biến động, cũng không né tránh khó khăn, mà kiên định tiến về mục tiêu bằng hiểu biết, bản lĩnh và những sửa soạn kĩ càng.   Bình an càng không phải điều hiển nhiên hay được “cài đặt” mặc định. Nó bắt đầu từ một khoảnh khắc lặng im, khi ta dừng lại để tự hỏi: “Tôi cần chuẩn bị những gì?”.   👉Chubb Life hân hạnh giới thiệu hành trình “Hiểu Bảo Vệ”, mở ra những góc nhìn đa chiều về BÌNH AN - nền móng vững chắc cho cuộc sống tự do và vững vàng hơn mỗi ngày.   💛Hãy cùng đón chờ và lan tỏa những câu chuyện ý nghĩa cùng Chubb Life nhé!  —- BẢO HIỂM CÓ CHUBB LO - DÁM SỐNG ĐỜI TỰ DO  #Chubb #ChubbLifeVietnam #BaohiemcoChubblo #Damsongdoitudo #HieuBaoVe",Chubb Life Vietnam,1091,19,265,https://www.facebook.com/BaohiemChubbLifeVietnam,https://www.facebook.com/BaohiemChubbLifeVietnam/posts/pfbid0254hcKiDbnkN11maiydrbmjt7973rcszVUhHNq375cujdt9GjrfHy6ddxpeN4roScl,1464544615712564,https://scontent.fsgn5-6.fna.fbcdn.net/v/t39.99422-6/727457707_1607564830924277_7969063764048934359_n.png?stp=dst-jpg_tt6&cstp=mx2000x2000&ctp=s1080x2048&_nc_cat=103&_nc_map=urlgen_bucketless&ccb=1-7&_nc_sid=127cfc&_nc_ohc=vvi-AQKmLDQQ7kNvwFkV9bQ&_nc_oc=AdqhFKMHywWA0O1MeTBnUi2Jd6yWYucgV05_7Zia2Its6si_l5phQWhhKU9L4fL3-vznSv6lveASUwyQmZiW3uc1&_nc_zt=14&_nc_ht=scontent.fsgn5-6.fna&_nc_gid=ax9rFUQ_1KthqLDmOeC__A&_nc_ss=7b2a8&oh=00_Af9VjwqT9z2vUP_dVsNXiPKmqTtwpwT5VaxEbNNlzuqKsA&oe=6A43D393,
2026-06-21,"Chào mừng 101 năm Ngày Báo chí Cách mạng Việt Nam (21.06.1925 – 21.06.2026)  Trải qua hơn một thế kỷ đồng hành cùng sự phát triển của đất nước, báo chí luôn giữ vai trò quan trọng trong việc kết nối thông tin, phản ánh hơi thở cuộc sống và lan tỏa những giá trị tích cực đến cộng đồng.  Nhân Ngày Báo chí Cách mạng Việt Nam 21.06, Chubb Life Việt Nam xin gửi lời chúc mừng và sự tri ân sâu sắc đến các cơ quan báo chí cùng Quý nhà báo, phóng viên, biên tập viên trên cả nước.   Trân trọng cảm ơn những người làm báo đã không ngừng cống hiến tâm huyết, bản lĩnh và trách nhiệm nghề nghiệp để mang đến những thông tin giá trị - góp phần kiến tạo một xã hội văn minh & phát triển.   #Chubb #ChubbLifeVietnam #BaohiemcoChubblo #Damsongdoitudo",Chubb Life Vietnam,32,4,0,https://www.facebook.com/BaohiemChubbLifeVietnam,https://www.facebook.com/BaohiemChubbLifeVietnam/posts/pfbid02SLLbvHLtVUcv255L3sQ7QfYK1axpr8dcH2jKzzxbYE4xkn8FzRkV9s9fth3bjhMyl,1463169589183400,https://scontent.fsgn5-22.fna.fbcdn.net/v/t39.99422-6/728969994_2115374989405287_4076063736191559883_n.png?stp=dst-jpg_tt6&cstp=mx1440x1440&ctp=s1080x2048&_nc_cat=105&_nc_map=urlgen_bucketless&ccb=1-7&_nc_sid=833d8c&_nc_ohc=s2OgD13PREwQ7kNvwFgth9k&_nc_oc=AdrND_3ZFwUv-h1aFsoqBTKPZIFtwUL1T8kIvxsBXuo6gVtrvocH9TPwODaCGaJeGRY6uhfNPMowfh9-gafg5RfR&_nc_zt=14&_nc_ht=scontent.fsgn5-22.fna&_nc_gid=UGdmkyW_YL7o6ptNdAXq2Q&_nc_ss=7b2a8&oh=00_Af-wtaBG00OX75LKcyj8QDuQqylKLKE8XnNf4K0yaWXqcA&oe=6A43BD24,
2026-06-20,"CHÚC MỪNG NGÀY CỦA CHA | 21.06.2026  Cảm ơn Cha - người đã học cả đời để biết cách thương con.  --- Không ai sinh ra đã biết làm Cha.  Hành trình ấy bắt đầu từ khoảnh khắc con đến với thế giới này.  Từ đó, Cha học cách chăm lo những đêm con sốt, học cách bảo vệ từng bước chân con, và học cách giấu đi những lo toan để trở thành điểm tựa mạnh mẽ cho con trưởng thành.  Cha tự học, tự ngẫm, tự hiểu. Không kể một câu. Không than một lời. 💙 Bởi tình thương của Cha vốn kiên nhẫn và lặng thầm như thế, nhưng vẫn luôn hiện diện suốt cả cuộc đời con.  Nhân Ngày của Cha, Chubb Life kính chúc những người Cha luôn thật nhiều sức khỏe, niềm vui và an yên, để có thêm thật nhiều thời gian đồng hành cùng những người mình yêu thương nhất.   Chubb Life luôn ở đây: 🛡 Để Cha thêm vững tâm chuẩn bị cho tương lai. 🛡 Để tình yêu và sự chở che của Cha có thể tiếp tục đồng hành cùng con trên những chặng đường phía trước.  Bảo hiểm có Chubb lo - Dám sống đời tự do!  #Chubb #ChubbLifeVietnam #BaoHiemCoChubbLo #DamSongDoiTuDo",Chubb Life Vietnam,3533,38,174,https://www.facebook.com/BaohiemChubbLifeVietnam,https://www.facebook.com/BaohiemChubbLifeVietnam/posts/pfbid02uyYTVSrQxTA2k8eptqzXt55WWLqtkwdL9rqqxUTqwNz38BcSD1GzoKx2gUkcyxdhl,1462752912558401,https://scontent.fsgn5-11.fna.fbcdn.net/v/t39.99422-6/727365616_1225560222927844_3413047657006098008_n.png?stp=dst-jpg_tt6&cstp=mx2000x2000&ctp=s2000x2000&_nc_cat=101&_nc_map=urlgen_bucketless&ccb=1-7&_nc_sid=127cfc&_nc_ohc=FeP-LMEN7DUQ7kNvwHcO_Sk&_nc_oc=AdrwstqBeaKyKQrDtI-ZabvX2qEzvzVRameLcGhGiQN-lcdvwj2J7jWy5DsIY9DaZqCs3Qar58WscwCQJZQjnD_G&_nc_zt=14&_nc_ht=scontent.fsgn5-11.fna&_nc_gid=UGdmkyW_YL7o6ptNdAXq2Q&_nc_ss=7b2a8&oh=00_Af_xcR9LmcSsUb0MrpdbZVnRGrTLvt9N7i5z9IvWYwS3sA&oe=6A43E62C | https://scontent.fsgn5-11.fna.fbcdn.net/v/t39.99422-6/727621731_863635739664457_3211906530607533741_n.png?stp=dst-jpg_tt6&cstp=mx2000x2000&ctp=s2000x2000&_nc_cat=106&_nc_map=urlgen_bucketless&ccb=1-7&_nc_sid=127cfc&_nc_ohc=j6TTRYSAEtMQ7kNvwFZsc9C&_nc_oc=AdrvHSIJHXgs-mLXovf94AbOR6K9ZQKKqHnqXg84TNooAfpa7wjHEJGsCbexhrnWzAXfe5IOZTOcuhEGDfDIvh8p&_nc_zt=14&_nc_ht=scontent.fsgn5-11.fna&_nc_gid=UGdmkyW_YL7o6ptNdAXq2Q&_nc_ss=7b2a8&oh=00_Af9aI8xdNt7I282-ULlTzzInfDgn0BSeVdKImpdJfVrOng&oe=6A43DECF | https://scontent.fsgn5-13.fna.fbcdn.net/v/t39.99422-6/726970088_1516991579350194_5379432007086599871_n.png?stp=dst-jpg_tt6&cstp=mx2000x2000&ctp=s2000x2000&_nc_cat=111&_nc_map=urlgen_bucketless&ccb=1-7&_nc_sid=127cfc&_nc_ohc=S7mJiVvpOOEQ7kNvwG1SfgN&_nc_oc=AdplT4ms-aVzNVCNzeUBRHUR62gl32CfOFguEpRu6SYlPaH6uEaNVbtEIkhvhfc7UQMT2nYrriKY8hrADI2ugwN-&_nc_zt=14&_nc_ht=scontent.fsgn5-13.fna&_nc_gid=UGdmkyW_YL7o6ptNdAXq2Q&_nc_ss=7b2a8&oh=00_Af8kil8ZnR1LZa5577nit6HReyWZEtbxGhiALeGY4yy3Dg&oe=6A43DF87 | https://scontent.fsgn5-21.fna.fbcdn.net/v/t39.99422-6/728783614_4096768977281870_7155528551648853024_n.png?stp=dst-jpg_tt6&cstp=mx2000x2000&ctp=s2000x2000&_nc_cat=100&_nc_map=urlgen_bucketless&ccb=1-7&_nc_sid=127cfc&_nc_ohc=rDyqjaqtW5kQ7kNvwEI4kGg&_nc_oc=Adr_C0XLnVoP37vvCKn9_k1x7S8nFjWE-MLTVILnxqCaVMKVvTjNXDKPFnobv7tw5bLG1y731pV6u3msXwOWTiG0&_nc_zt=14&_nc_ht=scontent.fsgn5-21.fna&_nc_gid=UGdmkyW_YL7o6ptNdAXq2Q&_nc_ss=7b2a8&oh=00_Af8kQ1yqgcYraoGaX_nodZmBJ0aMU_rQG_vzrpiIQt7qlA&oe=6A43D355,
2026-06-19,"❌Có “gan” thức khuya ❌Có “gan” lười vận động  ✅Có “gan” bảo vệ sức khỏe (còn gọi là GAN DẠ)  💡Vì GAN là cơ quan nội tạng nặng nhất trong cơ thể, trung tâm chuyển hóa năng lượng cho sự sống của con người - hãy hiểu đúng và bảo vệ gan từ hôm nay bạn nhé!   🥦Bắt đầu từ những thói quen nhỏ nhất: ngủ sớm hơn một chút, chăm thể thao hơn một chút, và ăn uống “lành” hơn mỗi ngày.  Tham khảo ngay “Sổ tay sống khỏe” #004 để tìm hiểu checklist các loại thực phẩm tốt cho gan!   🔔Và đừng quên lên kế hoạch bảo vệ từ sớm, phòng bị trước các bệnh hiểm nghèo - cho hành trình cuộc sống vô lo:  https://www.chubb.com/content/dam/chubb-sites/life-chubb-com/media-center/brochure-ci.pdf  #Chubb #ChubbLifeVietnam #BaohiemcoChubblo #Damsongdoitudo  #SoTaySongKhoe",Chubb Life Vietnam,76,14,240,https://www.facebook.com/BaohiemChubbLifeVietnam,https://www.facebook.com/reel/1939603776703678/,1461946899305669,https://scontent.fsgn5-22.fna.fbcdn.net/v/t15.5256-10/726470794_1023258897312156_6660762015079558864_n.jpg?stp=dst-jpg_tt6&cstp=mx1440x1440&ctp=s960x960&_nc_cat=106&_nc_map=urlgen_bucketless&ccb=1-7&_nc_sid=5fad0e&_nc_ohc=QF0zJvzvKoAQ7kNvwGRBVyf&_nc_oc=AdoCjGPgHPzRaorksNriJfy6JkNAcDq8Mcrd-YJvmxgtxntai4NY4xudElS_icsRr4cQCFD_tmopLKI3kKzXvK9A&_nc_zt=23&_nc_ht=scontent.fsgn5-22.fna&_nc_gid=UGdmkyW_YL7o6ptNdAXq2Q&_nc_ss=7b2a8&oh=00_Af8Y0tNpTlVU5VOQuQV2Jmd8ZCo9uH0hyuknSC7739UGiA&oe=6A43C0F5 | https://scontent.fsgn5-6.fna.fbcdn.net/v/t39.2093-6/727125064_1939604983370224_6467882968669321431_n.srt?_nc_cat=102&_nc_map=urlgen_bucketless&ccb=1-7&_nc_sid=c211c2&_nc_ohc=dBV2vmiZ-wkQ7kNvwHn-qWj&_nc_oc=Adoklv8psi5rALx5GjLAybtNerl-zewrhPUTkcZ8brmNUvnzNWugbYwov2s-mgIym1GDReLFaN_svdMM_zHcti-B&_nc_zt=14&_nc_ht=scontent.fsgn5-6.fna&_nc_gid=UGdmkyW_YL7o6ptNdAXq2Q&_nc_ss=7b2a8&oh=00_Af9CpgYjD7-P2OqKa6bM-kGMYq6obBd91pcCuFAw_rf6tA&oe=6A43E7A2 | https://scontent.fsgn5-12.fna.fbcdn.net/o1/v/t2/f2/m412/AQOHYyvT8CiGJSdPM7GzcUWPjfsbc8kL1Tre2DaA6Qo7SLhKzJ342hw_yPjMkj-TgNZL2kYz-MS9dUE41ykxrNTS5dzUFttXZCLHyK-djQ.mp4?_nc_cat=102&_nc_oc=AdrT-MiN4dxt5wkUzVJBhG1rITc2popWslRaPMAxoN-hSep8g3a_pdoMteJ60Xpd6qdpIahKKwmknxQw8X03ZC3r&_nc_sid=8bf8fe&_nc_ht=scontent.fsgn5-12.fna.fbcdn.net&_nc_ohc=TvZrYuB5k0cQ7kNvwFe4cL7&efg=eyJ2ZW5jb2RlX3RhZyI6Inhwdl9wcm9ncmVzc2l2ZS5GQUNFQk9PSy4uQzMuMzYwLnN2ZV9zZCIsInhwdl9hc3NldF9pZCI6MTgwNDgxNTI4NzU2ODE4NSwiYXNzZXRfYWdlX2RheXMiOjYsInZpX3VzZWNhc2VfaWQiOjEwMTIyLCJkdXJhdGlvbl9zIjo0OSwidXJsZ2VuX3NvdXJjZSI6Ind3dyJ9&ccb=17-1&_nc_gid=UGdmkyW_YL7o6ptNdAXq2Q&_nc_ss=7b2a8&_nc_map=urlgen_bucketless&_nc_zt=28&oh=00_Af-JK6X-VT3-KTleH8IuAEUHkYya6dO9qCzWLMrPs-Qq6A&oe=6A43EC68&bitrate=165873&tag=sve_sd | https://scontent.fsgn5-5.fna.fbcdn.net/o1/v/t2/f2/m366/AQPUahQYEGEdOmibooSq3wunwQV4egAJGjuG4mZrkJaqJtntm1uKXTyoyRQAgcumBxtOu-Q_b15OwJba96mq1P473l3LKqHbLAPgHEKhPGVjIw.mp4?_nc_cat=111&_nc_oc=Adq_RghP2STr7zShCWyddYvtsistMpblrlitNRY_TzYl7giF6QiWGrCUYfG3Dr8jx8EDmhlK8HYMutRyTvUkXUQI&_nc_sid=5e9851&_nc_ht=scontent.fsgn5-5.fna.fbcdn.net&_nc_ohc=AlUTkbgZECUQ7kNvwHe6oPM&efg=eyJ2ZW5jb2RlX3RhZyI6Inhwdl9wcm9ncmVzc2l2ZS5GQUNFQk9PSy4uQzMuNzIwLmRhc2hfaDI2NC1iYXNpYy1nZW4yXzcyMHAiLCJ4cHZfYXNzZXRfaWQiOjE4MDQ4MTUyODc1NjgxODUsImFzc2V0X2FnZV9kYXlzIjo2LCJ2aV91c2VjYXNlX2lkIjoxMDEyMiwiZHVyYXRpb25fcyI6NDksInVybGdlbl9zb3VyY2UiOiJ3d3cifQ%3D%3D&ccb=17-1&vs=b633e0da73082132&_nc_vs=HBksFQIYRWZiX2VwaGVtZXJhbC83NjQ0RDk1MDIzRUJDNUI3RjdFNEUyNUI0ODNDQzE4Ql9tdF8xX3ZpZGVvX2Rhc2hpbml0Lm1wNBUAAsgBEgAVAhhAZmJfcGVybWFuZW50L0M0NEZDQkRBMEYzMEEzOEYyNzI4MkQ5MTI1MTlGQ0E5X2F1ZGlvX2Rhc2hpbml0Lm1wNBUCAsgBEgAoABgAGwKIB3VzZV9vaWwBMRJwcm9ncmVzc2l2ZV9yZWNpcGUBMRUAACbynM7hid60BhUCKAJDMywXQEjkOVgQYk4YGWRhc2hfaDI2NC1iYXNpYy1nZW4yXzcyMHARAHUCZZSeAQA&_nc_gid=UGdmkyW_YL7o6ptNdAXq2Q&_nc_ss=7b2a8&_nc_map=urlgen_bucketless&_nc_zt=28&oh=00_Af92zvXLbTkwMD9O-iplxGSMUReSveNguSl01VHxbDckwg&oe=6A43BBAD&bitrate=467762&tag=dash_h264-basic-gen2_720p | https://scontent.fsgn5-22.fna.fbcdn.net/v/t15.5256-10/726470794_1023258897312156_6660762015079558864_n.jpg?stp=dst-jpg_tt6&cstp=mx1440x1440&ctp=s960x960&_nc_cat=106&_nc_map=urlgen_bucketless&ccb=1-7&_nc_sid=50ce42&_nc_ohc=QF0zJvzvKoAQ7kNvwGRBVyf&_nc_oc=AdoCjGPgHPzRaorksNriJfy6JkNAcDq8Mcrd-YJvmxgtxntai4NY4xudElS_icsRr4cQCFD_tmopLKI3kKzXvK9A&_nc_zt=23&_nc_ht=scontent.fsgn5-22.fna&_nc_gid=UGdmkyW_YL7o6ptNdAXq2Q&_nc_ss=7b2a8&oh=00_Af8Y0tNpTlVU5VOQuQV2Jmd8ZCo9uH0hyuknSC7739UGiA&oe=6A43C0F5 | https://scontent.fsgn5-11.fna.fbcdn.net/v/t15.5256-10/725678113_1710420666638314_1739802840704580165_n.jpg?stp=dst-jpg_tt6&cstp=mx1000x1000&ctp=s1000x1000&_nc_cat=104&_nc_map=urlgen_bucketless&ccb=1-7&_nc_sid=06012f&_nc_ohc=XkqE8QOTj6kQ7kNvwGWUpWo&_nc_oc=Adr8GZOhwBq55qfqn4Yq5YORev00ZXFkYPvjqVg9aPPCke9nZzWpVS-TwFXvybMsoN2Te4BUnAaPMZxEiyboiVad&_nc_zt=23&_nc_ht=scontent.fsgn5-11.fna&_nc_gid=UGdmkyW_YL7o6ptNdAXq2Q&_nc_ss=7b2a8&oh=00_Af8WGDyXt1bEaGX5DU4KAS6Xu-XTG-QB1gZZ9It67jhAZQ&oe=6A43BE08,https://www.facebook.com/reel/1939603776703678/
2026-06-18,"Vì sự cầu toàn nào cũng cần một điểm tựa an tâm.   💕Bạn là người cầu toàn, luôn muốn dành điều tốt nhất cho những giá trị sống quan trọng: sức khỏe của gia đình, niềm hạnh phúc của con, bình an cho tổ ấm…?  📍Tại Chubb Life, chúng tôi không chỉ mang đến các giải pháp bảo hiểm phù hợp, mà còn thiết kế trải nghiệm bảo vệ liền mạch, cá nhân hóa và tối ưu cho nhu cầu của chính bạn.   Với Sản phẩm Bảo hiểm Chăm sóc Sức khỏe Toàn cầu Chubb Care Plus, bạn vừa thảnh thơi chăm lo cho sức khỏe gia đình, vừa toàn ý với kế hoạch vun vén cuộc sống mà mình đã đặt ra.   Giải pháp sở hữu nhiều ưu điểm nổi bật: 🛡️Phạm vi bảo hiểm rộng: từ Việt Nam đến toàn cầu 🛡️Thuận tiện và nhanh chóng: Dịch vụ bảo lãnh viện phí tại hơn 600 bệnh viện, phòng khám trong và ngoài nước  🛡️Quyền lợi đa dạng và thiết thực: bao gồm điều trị nội trú, ngoại trú, nha khoa, thai sản   📝Tìm hiểu thông tin chi tiết tại: www.chubb.com/vn-vn/personal/chubb-care-plus.html —- *Hình ảnh minh họa cho Sản phẩm Bảo hiểm Chăm sóc Sức khỏe Toàn cầu Chubb Care Plus, được cung cấp bởi Công ty TNHH Chubb Việt Nam (Chubb Life Việt Nam).   #Chubb #ChubbLife #ChubbLifeVietnam  #ChubbCarePlus #BaohiemcoChubblo #Damsongdoitudo",Chubb Life Vietnam,2971,36,169,https://www.facebook.com/BaohiemChubbLifeVietnam,https://www.facebook.com/BaohiemChubbLifeVietnam/posts/pfbid0RYacZMNP6htGt6LLHzLGoSTXoC2A4gtCcMrHe3XJsS7hkQZUQqbBT8DhjnxyAhGNl,1460979422735750,https://scontent.fsgn5-12.fna.fbcdn.net/v/t39.99422-6/726200964_1778536453584300_252429599504892370_n.png?stp=dst-jpg_tt6&cstp=mx2000x2000&ctp=s1080x2048&_nc_cat=107&_nc_map=urlgen_bucketless&ccb=1-7&_nc_sid=833d8c&_nc_ohc=_6XbIE_39zoQ7kNvwFOCX6M&_nc_oc=AdpSO9UyjV-orb6W7k46YVH8sCmSiyPiSLcz4US6GIgbqzhWURd9UZdsfCPIuPxWHgEDPk7heqQxa0_LvfQvlBlu&_nc_zt=14&_nc_ht=scontent.fsgn5-12.fna&_nc_gid=ntexrWyXtDJXHMoPpz99Ew&_nc_ss=7b2a8&oh=00_Af_1hV8DNfwo5Gd4vuhx3KcDU6UIlF22ORfFd3alBM9FyQ&oe=6A43BA38,
2026-06-17,"SỨC KHỎE - NỀN TẢNG CHO HÀNH TRÌNH SỐNG ĐỜI TỰ DO!  Chúng ta giỏi sắp xếp công việc, gia đình và những sở thích cá nhân. Nhưng thường quen để sức khỏe ở cuối danh sách ưu tiên: 🥗 Deadline gấp - bỏ một bữa không sao. 🏃 Tuần này bận - tập thể dục để tuần sau. 🤕 Một cơn đau - cố thêm một chút thì sẽ qua.  Không phải vì chúng ta không biết sức khỏe quan trọng. Mà vì khi mọi thứ vẫn đang ổn, ta hiếm khi nghĩ đến việc một ngày nào đó điều ấy thay đổi.  Thế nhưng, sức khỏe luôn là nền tảng của mọi kế hoạch trong cuộc sống. Và bảo vệ sức khỏe không nên bắt đầu khi cơ thể buộc phải “lên tiếng”, mà từ khi mọi thứ vẫn còn đang tốt đẹp.   ✨ Chubb Life sắp mở ra một hành trình bảo vệ thông minh - bắt đầu từ tầng giá trị quan trọng này. Bình luận ""Hiểu bảo vệ để sống đời tự do"" để cùng Chubb chờ đón điều đặc biệt sắp hé lộ nhé!   Bảo hiểm có Chubb lo - Dám sống đời tự do.  #Chubb #ChubbLife #ChubbLifeVietnam #BaoHiemCoChubbLo #DamSongDoiTuDo",Chubb Life Vietnam,1542,18,362,https://www.facebook.com/BaohiemChubbLifeVietnam,https://www.facebook.com/BaohiemChubbLifeVietnam/posts/pfbid02LKdYdAUWCwav2ox6UuFiyPmfbaoyJbM6zo8KjMJUyMDHifdk1oaMCuzARbJTiYq5l,1460125542821138,https://scontent.fsgn5-8.fna.fbcdn.net/v/t39.99422-6/725616128_1339027791511824_1061388410022417735_n.png?stp=dst-jpg_tt6&cstp=mx2000x2000&ctp=s1080x2048&_nc_cat=102&_nc_map=urlgen_bucketless&ccb=1-7&_nc_sid=127cfc&_nc_ohc=dxnOnm2kLB8Q7kNvwE4LFJk&_nc_oc=Adr3m9_pT5aVOtAlpIIBpU9pOEqi5F6M8XQ0pN5FKXykDbd4oJHZomseUAuMbSAOWPKWD1N72u9N2c2SlJJnYDV_&_nc_zt=14&_nc_ht=scontent.fsgn5-8.fna&_nc_gid=ntexrWyXtDJXHMoPpz99Ew&_nc_ss=7b2a8&oh=00_Af_r_BY_CNtsf_mJS_f5axWasqN_FeT53ukrPZghA1hzbw&oe=6A43C87B,
